Modul,MOption,CheckValue,Tanim,Typex,Valuex,EditTypeX,PWinCaption,PTable,PRField,PRFields,PRFieldsValues,Katalog,PassChar,kgid,insUN,insDT,insApp,updUN,updDT,updApp
KrediFis,NoMuhKodSave,Hayir,Fiş kaydı sırasında muhasebe kodu kontrolü sağlansın mı?,ComboBox,Evet&Hayir,,,,,,,,,874,,,,,,
KrediFis,SaveMuh,Hayir,Kredi kartı işlemlerinde kaydetme işleminden sonra muhasebeleşme otomatik başlasın mı?,ComboBox,Evet&Hayir,,,,,,,,,1180,,,,,,
Mail,EkKlasor,,Maillere eklenen dosyaların serverda saklanacağı yer,Edit,,txt,,,,,,,,425,,,,,,
Masraf,OzKod1,Özel Kod 1,Masraf Özel Kod 1 in tanımı,Edit,,txt,,,,,,,,958,,,,,,
Masraf,OzKod10,Özel Kod 10,Masraf Özel Kod 10 un tanımı,Edit,,txt,,,,,,,,965,,,,,,
Masraf,OzKod2,Özel Kod 2,Masraf Özel Kod 2 nin tanımı,Edit,,txt,,,,,,,,992,,,,,,
Masraf,OzKod3,Özel Kod 3,Masraf Özel Kod 3 ün tanımı,Edit,,txt,,,,,,,,1012,,,,,,
Masraf,OzKod4,Özel Kod 4,Masraf Özel Kod 4 ün tanımı,Edit,,txt,,,,,,,,1031,,,,,,
Masraf,OzKod5,Özel Kod 5,Masraf Özel Kod 5 in tanımı,Edit,,txt,,,,,,,,1050,,,,,,
Masraf,OzKod6,Özel Kod 6,Masraf Özel Kod 6 nın tanımı,Edit,,txt,,,,,,,,1059,,,,,,
Masraf,OzKod7,Özel Kod 7,Masraf Özel Kod 7 nin tanımı,Edit,,txt,,,,,,,,1066,,,,,,
Masraf,OzKod8,Özel Kod 8,Masraf Özel Kod 8 in tanımı,Edit,,txt,,,,,,,,1073,,,,,,
Masraf,OzKod9,Özel Kod 9,Masraf Özel Kod 9 un tanımı,Edit,,txt,,,,,,,,1080,,,,,,
Muh,DtEntegr,Hayir,Detaylı entegrasyon ekranı açıldığında otomatik olarak ekran dolsun mu ?,ComboBox,Evet&Hayir,,,,,,,,,298,,,,,,
Muh,DtEntegr2,Hayir,Detaylı entegrasyon ekranı için açık modüller kontrolü yapılsın mı ?,ComboBox,Evet&Hayir,,,,,,,,,299,,,,,,
Muh,EbynBilancoSablonId,,E-Beyanname programında kullanılacak Bilanço Tablosu Şablon ID:,Edit,,txt,,,,,,,,305,,,,,,
Muh,EbynGelirTblSablonId,,E-Beyanname programında kullanılacak Gelir Tablosu Şablon ID:,Edit,,txt,,,,,,,,306,,,,,,
Muh,EBynKullanici,,E-Beyanname sistemi kullanıcı kodunuz,Edit,,txt,,,,,,,,307,,,,,,
Muh,EBynParola,,E-Beyanname sistemi parolanız,Edit,,txt,,,,,,,,308,,,,,,
Muh,EBynSifre,,E-Beyanname sistemi şifreniz,Edit,,txt,,,,,,,,309,,,,,,
Muh,EDClientWD,,E-Defter oluştururken sql server üzerinde kullanılacak geçici dizinin network adresi (Ör: \\SERVER\edefter\),Edit,,txt,,,,,,,,310,,,,,,
Muh,EDDefaultDir,C:\Korgun\edefter\,E-Defter lisans ve konfigurasyon dosyaları için dizin,Edit,,txt,,,,,,,,311,,,,,,
Muh,EDEntPassword,,E-Defter için entegratör şifre,Edit,,txt,,,,,,,,312,,,,,,
Muh,EDEntUserName,,E-Defter için entegratör kullanıcı adı,Edit,,txt,,,,,,,,313,,,,,,
Muh,EDJavaExe,,java.exe dosyasının yolu (E-Defter),Edit,,txt,,,,,,,,314,,,,,,
Muh,EDKatalogBaz,Hayir,E-Defter parametreleri katalog bazlı olsun mu?,ComboBox,Evet&Hayir,,,,,,,,,315,,,,,,
Muh,EDMaxSize,100,E-Defter maksimum boyutu (Megabyte),Edit,,txt,,,,,,,,316,,,,,,
Muh,EDMuhurPin,,E-Defter Mühür Pin Kodu,Edit,,txt,,,,,,,,317,,,,,,
Muh,EDServerWD,,E-Defter oluştururken sql server üzerinde kullanılacak geçici dizin (Ör: C:\edefter\),Edit,,txt,,,,,,,,318,,,,,,
Muh,EDStartDate,,E-Defter geçerlilik başlangıç tarihi (Ör: 01.01.2015),Edit,,txt,,,,,,,,319,,,,,,
Muh,EDStartSatirNo,1,E-Defter başlangıç satır numarası,Edit,,txt,,,,,,,,320,,,,,,
Muh,EDStartUnqId,1,E-Defter başlangıç tekil numarası,Edit,,txt,,,,,,,,321,,,,,,
Muh,EDStartYNO,,E-Defter ilk yevmiye madde numarası,Edit,,txt,,,,,,,,322,,,,,,
Muh,EDXMLFileOpen,Hayir,Onaylanmış e-defter xml leri sadece dosya olarak saklansın mı?,ComboBox,Evet&Hayir,,,,,,,,,323,,,,,,
Muh,EDZamanli,Hayir,E-Defter imzalanırken zaman damgası kullanılsın mı?,ComboBox,Evet&Hayir,,,,,,,,,324,,,,,,
Muh,EvrNoReq,Hayir,Muhasebe fişi girilirken evrak numarası/tarihi boş ise uyarı versin mi?,ComboBox,Evet&Hayir,,,,,,,,,449,,,,,,
Muh,FatBABSKontrol,Hayir,"Döküman tipi ""Fatura"" olan yeni bir muhasebe fişi kaydedilirken BABS kodu kontrolü yapılsın mı?",ComboBox,Evet&Hayir,,,,,,,,,459,,,,,,
Muh,FisUpdate,Hayir,Muhasebe Fişlerinde silme-değiştirme olsun mu ?,ComboBox,Evet&Hayir,,,,,,,,,472,,,,,,
Muh,FtMalMuhFis,Hayir,Satış ve Satış iade Faturaları muhasebeleştirmesinde maliyet muhasebe fişi oluşsun mu ?,ComboBox,Evet&Hayir,,,,,,,,,488,,,,,,
Muh,FtMalMuhFisSor,Hayir,Satış ve Satış iade Fatura muhasebeleştirmesinde maliyet muhasebe fişi oluştururken soru sorsun mu ?,ComboBox,Evet&Hayir,,,,,,,,,489,,,,,,
Muh,GDKLocKont,Hayir,Gider Kartları muhasebe kod bağlantıları lokasyon bazlı olsun mu?,ComboBox,Evet&Hayir,,,,,,,,,495,,,,,,
Muh,GelirGiderPrType,Yansıtmalı,Gelir-Gider kapama işlemleri hangi sisteme göre çalışsın?,ComboBox,Yansıtmalı&Yansıtmasız,,,,,,,,,497,,,,,,
Muh,GLKLocKont,Hayir,Gelir Kartları muhasebe kod bağlantıları lokasyon bazlı olsun mu?,ComboBox,Evet&Hayir,,,,,,,,,503,,,,,,
Muh,GrupEvrakNo,Hayir,Raporda evrak numarası ve evrak tarihini kullanılsınmı?,ComboBox,Evet&Hayir,,,,,,,,,508,,,,,,
Muh,HizLocKont,Hayir,Hizmet kartları muhasebe kod bağlantıları lokasyon bazlı olsun mu?,ComboBox,Evet&Hayir,,,,,,,,,560,,,,,,
Muh,HpListBakiyeLoc,Hayir,Hesap Planı Listesinde Hesap Bakiyesi tüm lokasyonlara göre  gelsin mi ?,ComboBox,Evet&Hayir,,,,,,,,,564,,,,,,
Muh,HsPlanBakiye,Hayir,Hesap Planı Listesinde Hesap Bakiyesi görünsün mü ?,ComboBox,Evet&Hayir,,,,,,,,,566,,,,,,
Muh,HsPlanOzKod,Hayir,Hesap Planı Listesinde Hesap özel kodları görünsün mü ?,ComboBox,Evet&Hayir,,,,,,,,,567,,,,,,
Muh,IskontoKdv,Evet,Perakende Muhasebe fişlerinde iskonto kdv dahil mi?,ComboBox,Evet&Hayir,,,,,,,,,578,,,,,,
Muh,KarsiDovFieldsVis,Evet,Muhasebe hesap fişi içerisinde karşı döviz alanları görünsün  mü ?,ComboBox,Evet&Hayir,,,,,,,,,618,,,,,,
Muh,KrediOdemeFisNoTut,Hayir,Banka kredi ödeme fişi ana tutar olmadan muhasebeleştirilebilsin mi?,ComboBox,Evet&Hayir,,,,,,,,,657,,,,,,
Muh,M12Mizan,Hayir,1 ve 2 haneli hesaplar mizanda alt toplamları etkilesin mi?(1-10-2-20 vb.),ComboBox,Evet&Hayir,,,,,,,,,690,,,,,,
Muh,M1KadGirKont,Evet,Muhasebe fişlerinde ana hesaplara işlem yapılabilsin mi?,ComboBox,Evet&Hayir,,,,,,,,,691,,,,,,
Muh,M1KadMuhHes,Evet,1. Kademe muhasebe hesap kodu açılabilsin mi?,ComboBox,Evet&Hayir,,,,,,,,,692,,,,,,
Muh,MalFisFiyatTipi ,Aktif Alış,Maliyet muhasebe fişi oluştururken hangi fiyatı kullansın?,ComboBox,Aktif Alış&Ağırlıklı Ortalama&Fifo,,,,,,,,,699,,,,,,
Muh,MalFisSatBirles,Hayir,Satış ve Satış iade Fatura muhasebeleştirmesinde maliyet muhasebe fişi oluştururken satır birleştirme yapılsın mı ?,ComboBox,Evet&Hayir,,,,,,,,,700,,,,,,
Muh,MBABS,Hayir,BABS kodu kullanılsınmı?,ComboBox,Evet&Hayir,,,,,,,,,720,,,,,,
Muh,MBelgeNoDel,Hayir,Belge numarası dolu olan muhasebe fişi silinemesin,ComboBox,Evet&Hayir,,,,,,,,,721,,,,,,
Muh,MCSLocKont,Hayir,Çek-Senet muhasebe kod bağlantıları lokasyon bazlı olsun mu?,ComboBox,Evet&Hayir,,,,,,,,,723,,,,,,
Muh,MDefFisTip,Mahsup,Muhasebe fişlerinde varsayılan fiş tipi nedir?,ComboBox,Acilis&Tahsil&Tediye&Mahsup&Ozel&KurFarki&Kapanis,,,,,,,,,724,,,,,,
Muh,MDigitSor,Hayir,Fişler yazdırılırken ondalık hassasiyet sorsun mu?,ComboBox,Evet&Hayir,,,,,,,,,725,,,,,,
Muh,MDovizli,Hayir,Dovizli muhasebe kullanılsınmı?,ComboBox,Evet&Hayir,,,,,,,,,726,,,,,,
Muh,MEntAnaPB,Evet,Entegrasyon sonucu oluşan fişler ana paracinsi üzerinden olsun,ComboBox,Evet&Hayir,,,,,,,,,732,,,,,,
Muh,MEntegreDel,Hayir,Entegre edilmiş olan muhasebe fişi silinemesin,ComboBox,Evet&Hayir,,,,,,,,,733,,,,,,
Muh,MEntegreUPT,Hayir,Entegre edilmiş olan muhasebe fişi değiştirilemesin,ComboBox,Evet&Hayir,,,,,,,,,734,,,,,,
Muh,MEvrakNo,Hayir,Muhasebe fişinde evrano ve evrak tarihi kullanılsınmı?,ComboBox,Evet&Hayir,,,,,,,,,736,,,,,,
Muh,MFatAlisisk,MaliyetHesap,Alış fatura iskontoları nereye gitsin?,ComboBox,MuhHesap&MaliyetHesap,,,,,,,,,737,,,,,,
Muh,MFatSatisisk,MaliyetHesap,Satış fatura iskontoları nereye gitsin?,ComboBox,MuhHesap&MaliyetHesap,,,,,,,,,738,,,,,,
Muh,MFisCagir,Hayir,Muhasebe fişinde eski fiş çağırmada fiş tipi filtreleme olsun mu?,ComboBox,Evet&Hayir,,,,,,,,,740,,,,,,
Muh,MFisiptal,Hayir,Muhasebe fişinin içinde iptal etme özelliği gösterilsin mi?,ComboBox,Evet&Hayir,,,,,,,,,742,,,,,,
Muh,MFisKodElle,Hayir,Muhasebe fişlerinde muhasebe kodu elle girilebilsin mi?,ComboBox,Evet&Hayir,,,,,,,,,743,,,,,,
Muh,MFisList,Hayir,Muhasebe fişinde eski fiş çağırmada Fişleri Fiş Tarihine göre sıralasın mı?,ComboBox,Evet&Hayir,,,,,,,,,744,,,,,,
Muh,MFisSil,Hayir,Muhasebeleştirilmiş bir kayıt değişiklik yapıldığında muhasebe fişini silme sorusunu sorsun mu?,ComboBox,Evet&Hayir,,,,,,,,,745,,,,,,
Muh,MGenAckAyrac, ,Entegrasyon sırasında genel açıklamalarının arasına koyulacak ayraç,Edit,,txt,,,,,,,,746,,,,,,
Muh,MGGLocation,,Genel gider dağılımı muhasebeleştirilirken oluşacak fişin lokasyonu,Edit,,txt,,,,,,,,747,,,,,,
Muh,MHesBAKont,Evet,Muhasebe fişi girilirken hesapların borç / alacak çalışamaz kontrolü yapılsın mı?,ComboBox,Evet&Hayir,,,,,,,,,748,,,,,,
Muh,MisKaldir,Evet,Muhasebeleştirilmiş bir kayıt değişiklik yapılıp kaydedilince muhasebe işareti sorusunu sorsun mu?,ComboBox,Evet&Hayir,,,,,,,,,753,,,,,,
Muh,MizanBABakiye,Hayir,Mizan raporunda Borc Bakiye-Alacak Bakiye ana hesabın farkı olsun mu,ComboBox,Evet&Hayir,,,,,,,,,754,,,,,,
Muh,MizanFisTipKri,Hayir,Mizan raporu ekranında fiş tipleri kriteri verilebilsin mi?,ComboBox,Evet&Hayir,,,,,,,,,755,,,,,,
Muh,MizanTop,Hayir,Mizan raporunda hesap aralığı toplamı olsun,ComboBox,Evet&Hayir,,,,,,,,,756,,,,,,
Muh,MKDVLocKont,Hayir,KDV  muhasebe kod bağlantıları lokasyon bazlı olsun mu?,ComboBox,Evet&Hayir,,,,,,,,,757,,,,,,
Muh,MMaddeNoDel,Hayir,Yevmiye madde numarası dolu olan muhasebe fişi silinemesin,ComboBox,Evet&Hayir,,,,,,,,,758,,,,,,
Muh,MMaliDonemBas,01/01/2023,Mali dönem başlangıç tarihi(gg/aa/yyyy formatında giriniz) (YULYA),Edit,,txt,,,,,,YULYA,,759,,,,,,
Muh,MMaliDonemBit,31/12/2023,Mali dönem bitiş tarihi(gg/aa/yyyy formatında giriniz) (YULYA),Edit,,txt,,,,,,YULYA,,760,,,,,,
Muh,MMiktarli,Hayir,Miktarlı muhasebe kullanılsınmı?,ComboBox,Evet&Hayir,,,,,,,,,761,,,,,,
Muh,MMizanSifir,Hayir,Muhasebe raporlarında 0 olan değerler gözükmesin,ComboBox,Evet&Hayir,,,,,,,,,762,,,,,,
Muh,MMuhControl,Evet,Muhasebeleştirilmiş bir kayıt tekrar muhasebeleştirilebilsin mi?,ComboBox,Evet&Hayir,,,,,,,,,763,,,,,,
Muh,MMUse,Hayir,Masraf merkezi kullanımı olsun mu?,ComboBox,Evet&Hayir,,,,,,,,,764,,,,,,
Muh,MOnKaySilMuh,Hayir,Muhasebeleştirilmiş bir kayıt silinince bağlı olduğu muhasebe fişide silinsin mi?,ComboBox,Evet&Hayir,,,,,,,,,796,,,,,,
Muh,MOtoBelgeNo,Hayir,Belge numarası otomatik artsın mı?,ComboBox,Evet&Hayir,,,,,,,,,797,,,,,,
Muh,MOtoBNoDig,6,Belge Numarası arttılırken karakter sayısı kaç olsun?,Edit,,txt,,,,,,,,798,,,,,,
Muh,MOtoBNoLoc,Hayir,Belge numarası arttırılırken fişlerin lokasyonu dikkate alınsın mı?,ComboBox,Evet&Hayir,,,,,,,,,799,,,,,,
Muh,MOtoBNoTip,Yok,Belge numarası arttırım şekli ne olsun?,ComboBox,Yok&FTip&Gun&GunFTip,,,,,,,,,800,,,,,,
Muh,MOtoKasaFisi,Evet,Kapalı faturalarda muhasebe entegrasyonunda kasa fişi birleştirilerek işlensin,ComboBox,Evet&Hayir,,,,,,,,,801,,,,,,
Muh,MOTVLocKont,Hayir,ÖTV  muhasebe kod bağlantıları lokasyon bazlı olsun mu?,ComboBox,Evet&Hayir,,,,,,,,,802,,,,,,
Muh,MParSatisisk,MaliyetHesap,Parekende satış ve iade işlemlerinin iskontoları nereye gitsin?,ComboBox,MuhHesap&MaliyetHesap,,,,,,,,,803,,,,,,
Muh,MSatAckAyrac, ,Entegrasyon sırasında satır açıklamalarının arasına koyulacak ayraç,Edit,,txt,,,,,,,,811,,,,,,
Muh,MSMMLocKont,Hayir,Serbest Meslek muhasebe kod bağlantıları lokasyon bazlı olsun mu?,ComboBox,Evet&Hayir,,,,,,,,,812,,,,,,
Muh,MTahsil100,Evet,Tahsil fişlerinde 100 kasa hesap kontrolü olsun mu?,ComboBox,Evet&Hayir,,,,,,,,,813,,,,,,
Muh,MTediye100,Evet,Tediye fişlerinde 100 kasa hesap kontrolü olsun mu?,ComboBox,Evet&Hayir,,,,,,,,,814,,,,,,
Muh,MTemLocKont,Hayir,Teminat mektubu muhasebe kod bağlantıları lokasyon bazlı olsun mu?,ComboBox,Evet&Hayir,,,,,,,,,815,,,,,,
Muh,MTevLocKont,Hayir,Tevkifat muhasebe kod bağlantıları lokasyon bazlı olsun mu?,ComboBox,Evet&Hayir,,,,,,,,,816,,,,,,
Muh,MTKDVLocKont,Hayir,Tevkifat işlemlerinde ki KDV muhasebe kod bağlantıları lokasyon bazlı olsun mu?,ComboBox,Evet&Hayir,,,,,,,,,817,,,,,,
Muh,MuavinGorEksi,Hayir,Hesap kartında muavin Excel e aktarırken bakiye (-) olarak görünsün mü ?,ComboBox,Evet&Hayir,,,,,,,,,825,,,,,,
Muh,MuhEntTutar,Evet,Detaylı muhasebe entegrasyonda tutara göre arama yapsın mı?,ComboBox,Evet&Hayir,,,,,,,,,827,,,,,,
Muh,OzKod1,Özel Kod 1,Muhasebe Özel Kod 1 in adı,Edit,,txt,,,,,,,,959,,,,,,
Muh,OzKod10,Özel Kod 10,Muhasebe Özel Kod 10 ün adı,Edit,,txt,,,,,,,,966,,,,,,
Muh,OzKod2,Özel Kod 2,Muhasebe Özel Kod 2 nin adı,Edit,,txt,,,,,,,,993,,,,,,
Muh,OzKod3,Özel Kod 3,Muhasebe Özel Kod 3 ün adı,Edit,,txt,,,,,,,,1013,,,,,,
Muh,OzKod4,Özel Kod 4,Muhasebe Özel Kod 4 ün adı,Edit,,txt,,,,,,,,1032,,,,,,
Muh,OzKod5,Özel Kod 5,Muhasebe Özel Kod 5 ün adı,Edit,,txt,,,,,,,,1051,,,,,,
Muh,OzKod6,Özel Kod 6,Muhasebe Özel Kod 6 ün adı,Edit,,txt,,,,,,,,1060,,,,,,
Muh,OzKod7,Özel Kod 7,Muhasebe Özel Kod 7 ün adı,Edit,,txt,,,,,,,,1067,,,,,,
Muh,OzKod8,Özel Kod 8,Muhasebe Özel Kod 8 ün adı,Edit,,txt,,,,,,,,1074,,,,,,
Muh,OzKod9,Özel Kod 9,Muhasebe Özel Kod 9 ün adı,Edit,,txt,,,,,,,,1081,,,,,,
Muh,PeriyotKullan,Hayir,Muhasebe Raporlarında Periyot Kullanılsın mı?,ComboBox,Evet&Hayir,,,,,,,,,1094,,,,,,
Muh,RapTarihChecked,Hayir,Muhasebe raporlarında tarih seçili olsun mu?,ComboBox,Evet&Hayir,,,,,,,,,1128,,,,,,
Muh,StkFisMuh,Hayir,Stok Fişleri üretimle bağlantı olmasa bile muhasebeleştirilebilsin mi?,ComboBox,Evet&Hayir,,,,,,,,,1272,,,,,,
Muh,StkGrpBag,Hicbiri,Stok muhasebe entegre kodları hangi gruptan getirilerek stok kartına yazılsın?,ComboBox,Hicbiri&StokSekli&StokGrubu&StokTip&Cinsiyet&KDVOran&Reyon,,,,,,,,,1273,,,,,,
Muh,TahakkukA,190.01.001,Tahakkuk fişindeki -DEVREDEN KDV- hesap kodu,Edit,,txt,,,,,,,,1300,,,,,,
Muh,TahakkukB,360.01.001,Tahakkuk fişindeki -ÖDENECEK VERGİ VE FONLAR- hesap kodu,Edit,,txt,,,,,,,,1301,,,,,,
Muh,Tahakkuki,,Tahakkuk fişindeki kdv iade hesap kodu,Edit,,txt,,,,,,,,1302,,,,,,
Muh,TahakkukO,,Tahakkuk fişindeki ödenecek kdv hesap kodu,Edit,,txt,,,,,,,,1303,,,,,,
Mus,CepNoRequired,Hayir,Müşteri kartları kaydedilirken cep telefonu girilmesi zorunlu mu?,ComboBox,Evet&Hayir,,,,,,,,,196,,,,,,
Mus,CinsiyetZorunlu,Hayir,Müşteri kartları kaydedilirken cinsiyet seçimi zorunlu mu?,ComboBox,Evet&Hayir,,,,,,,,,202,,,,,,
Mus,DefCountry,Türkiye,Yeni müşteri kaydedilirken varsayılan ülke,Edit,,txt,,,,,,,,256,,,,,,
Mus,defNoMail,Hayir,"Yeni müşteriler için varsayılan olarak ""mail gönderme"" seçili gelsin mi?",ComboBox,Hayir&Evet,,,,,,,,,258,,,,,,
Mus,defNoSms,Hayir,"Yeni müşteriler için varsayılan olarak ""mesaj gönderme"" seçili gelsin mi?",ComboBox,Hayir&Evet,,,,,,,,,259,,,,,,
Mus,IYSApiKey,,PostaGuvercini izin API anahtarı,Edit,,txt,,,,,,,,580,,,,,,
Mus,IYSSorgulasinMi,Sor,Müşteri numarası girildikten sonra IYS izin mesajı gönderilsin mi?,ComboBox,Sor&Evet&Hayır,,,,,,,,,581,,,,,,
Mus,MusAyniTel,Evet,Müşteri kartları kaydedilirken aynı cep telefonu ile 2 müşteri kaydedilebilsin mi?,ComboBox,Evet&Hayir,,,,,,,,,835,,,,,,
Mus,MusTelControl,Evet,Müşteri kartlarında telefon numarası kontrolü yapılsın mı?,ComboBox,Evet&Hayir,,,,,,,,,837,,,,,,
Mus,MusTelLength,10,Müşteri kartında tel numarası kaç karakter olsun?,Edit,,txt,,,,,,,,838,,,,,,
Mus,NoCepAlert,Hayir,Müşteri kartları kaydedilirken cep telefonu boş ise uyarı versin mi?,ComboBox,Evet&Hayir,,,,,,,,,857,,,,,,
Mus,NoMailAlert,Hayir,Müşteri kartları kaydedilirken e-Mail boş ise uyarı versin mi?,ComboBox,Evet&Hayir,,,,,,,,,866,,,,,,
Mus_gizli,ZorunluMaster,*,,Edit,,txt,,,,,,,,1465,,,,,,
Musteri_Gizli,ZorunluMaster,*,,Edit,,txt,,,,,,,,1466,,,,,,
PosFis,ActivDepart,K,Pos modülünü kullanabilecek departman kodu nedir?,Edit,,txt,,,,,,,,9,,,,,,
PosFis,ActivFatDizayn,<Default>,Perakende fatura çıktısının alınacağı dizayn,Edit,,txt,,,,,,,,10,,,,,,
PosFis,AiadeFatDizayn,<Default>,Perakende iade çıktısının alınacağı dizayn,Edit,,txt,,,,,,,,37,,,,,,
PosFis,AlterStokOner,Hayir,Mevcudu olmayan ürünler için alternatif önerilsin mi?,ComboBox,Evet&Hayir,,,,,,,,,41,,,,,,
PosFis,ArasBarcode,ör:ozkod1,Aras Kargo nun Barkod bilgisi hangi Özel Kod a yazılsın?,Edit,,txt,,,,,,,,44,,,,,,
PosFis,ArasOdeSekli,Gönderici Ödemeli,Aras Kargo Ödeme Şekli Ne Olsun?,ComboBox,Gönderici Ödemeli&Alıcı Ödemeli,,,,,,,,,45,,,,,,
PosFis,ArasPass,,Aras Kargo nun Size Vermiş Olduğu Şifreyi Giriniz,Edit,,txt,,,,,,,,46,,,,,,
PosFis,ArasTahsilSekli,Aynı Fatura,Aras Kargo Tahsilat Şekli Ne Olsun?,ComboBox,Aynı Fatura&Farklı Fatura,,,,,,,,,48,,,,,,
PosFis,ArasUser,,Aras Kargo nun Size Vermiş Olduğu Kullanıcı Kodunu Giriniz,Edit,,txt,,,,,,,,49,,,,,,
PosFis,AutoBelgeNo,Evet,Belge numarası otomatik artsın mı?,ComboBox,Evet&Hayir,,,,,,,,,57,,,,,,
PosFis,AutoBelgeNoKri,Yok,Belge numarası artımında belge numarasının seçim kriteri ne olsun?,ComboBox,Yok&Lokasyon&Kasiyer&Kasa,,,,,,,,,59,,,,,,
PosFis,AutoBelgeNoTip,Hayir,Belge numarası otomatik artımında son kaydın belge numarası mı kullanılsın?,ComboBox,Evet&Hayir,,,,,,,,,60,,,,,,
PosFis,BarCodeCheck,Evet,Satışta barkod cihazı kullanılacak mı?,ComboBox,Evet&Hayir,,,,,,,,,104,,,,,,
PosFis,BcinUseMik,Hayir,Kullanılan barkodların içinde miktar tanımlaması var mı?,ComboBox,Evet&Hayir,,,,,,,,,110,,,,,,
PosFis,BcinUseMikK,29,Kullanılan barkodların başlangıç karakterleri,Edit,,num,,,,,,,,111,,,,,,
PosFis,BcinUseMikLn,5,Barkod içindeki miktar sondan kaç karakterde?,Edit,,num,,,,,,,,113,,,,,,
PosFis,BcinUseMikLnD,3,Barkod içindeki miktarın desimal basamak sayısı,Edit,,num,,,,,,,,116,,,,,,
PosFis,BcinUseMzLC,0,Miktarlı barkodun sondan kaç hanesi dikkate alinmasin(Check Digit)?,Edit,,num,,,,,,,,119,,,,,,
PosFis,BcinUseMzLCB,0,Miktarlı barkodun Baştan kaç hanesi dikkate alinmasin(Check Digit)?,Edit,,num,,,,,,,,120,,,,,,
PosFis,BcMaxLength,0,Barkod okutma alanının maximum karakter sayısı (0=sınırsız),Edit,,num,,,,,,,,124,,,,,,
PosFis,BelgeNoReq,Hayir,Belge numarası girilmesi zorunlu mu?,ComboBox,Evet&Hayir,,,,,,,,,143,,,,,,
PosFis,BelNoBarkod,Hayir,Belge No barkod ile okutulsun mu?,ComboBox,Evet&Hayir,,,,,,,,,144,,,,,,
PosFis,ChckFiy,Hayir,Aktif olan kurun en son fiyatı?,ComboBox,Evet&Hayir,,,,,,,,,200,,,,,,
PosFis,Deny_KDV,Evet,Kullanıcı ürünün KDV sine müdahale edebilsin mi?,ComboBox,Evet&Hayir,,,,,,,,,265,,,,,,
PosFis,Deny_PC,Evet,Kullanıcı ürünün para cinsine müdahale edebilsin mi?,ComboBox,Evet&Hayir,,,,,,,,,266,,,,,,
PosFis,DespatchDateOzKod,,Perakende satış İrsaliye tarihinin alınacağı Özel Kod:,ComboBox,OzKod1&OzKod2&OzKod3&OzKod4&OzKod5&OzKod6&OzKod7&OzKod8&OzKod9&OzKod10&OzKod11&OzKod12&OzKod13&OzKod14&OzKod15&OzKod16&OzKod17&OzKod18&OzKod19&OzKod20,,,,,,,,,267,,,,,,
PosFis,DespatchNoOzKod,,Perakende satış İrsaliye numarasının alınacağı Özel Kod:,ComboBox,OzKod1&OzKod2&OzKod3&OzKod4&OzKod5&OzKod6&OzKod7&OzKod8&OzKod9&OzKod10&OzKod11&OzKod12&OzKod13&OzKod14&OzKod15&OzKod16&OzKod17&OzKod18&OzKod19&OzKod20,,,,,,,,,268,,,,,,
PosFis,DiplomatFatDizayn,<Default>,Diplomatik fatura çıktısının alınacağı dizayn,Edit,,txt,,,,,,,,289,,,,,,
PosFis,EFDefLocation,,Perakende satıştan oluşan fatura hangi lokasyonda oluşsun?,Edit,,txt,,,,,,,,354,,,,,,
PosFis,EFEAStokSendType,Stok,E-Fatura/E-Arşiv Stok Gönderim Şekli,ComboBox,Stok&Stok/Renk&Stok/Beden&Stok/Renk/Beden&Stok/Renk/Beden/StokBarkodu,,,,,,,,,355,,,,,,
PosFis,EFNoteMusOzKod,Hayir,Perakende E-Fatura/E-Arşiv fatura not kısmında müşteri özel kodlar gürüntülensin mi? ,ComboBox,Hayir&Evet,,,,,,,,,377,,,,,,
PosFis,EFNotePaymentType,Hayir,Perakende E-Arşiv faturada Notlar kısmında ödeme tip tanımları yer alsın mı?(Netten Satış),ComboBox,Hayir&Evet,,,,,,,,,378,,,,,,
PosFis,EFNotePosOzKod,Hayir,Perakende E-Fatura/E-Arşiv fatura not kısmında perakende satış özel kodlar gürüntülensin mi? ,ComboBox,Hayir&Evet,,,,,,,,,379,,,,,,
PosFis,EFOtoCKod,,"Perakende satış, fatura işlemine çevrilirken ilk cari kod ne olsun?",Edit,,txt,,,,,,,,382,,,,,,
PosFis,EFOtoTaslak,Hayir,Perakende satış ekranından e-fatura taslağı oluşturmak istiyor musunuz?,ComboBox,Evet&Hayir,,,,,,,,,383,,,,,,
PosFis,EFPerSevkAdress,Hayir,Perakende E-Fatura da sevk adresi çıksın mı ?(Müşteri Kartı İş Adresi),ComboBox,Hayir&Evet,,,,,,,,,388,,,,,,
PosFis,EFPosSipNoOzKod,,E-Fatura oluşturulurken Sipariş numarası bilgisi faturanın hangi özel kod alanından alınsın ?,Edit,,txt,,,,,,,,389,,,,,,
PosFis,EFPosSipTarOzKod,,E-Fatura oluşturulurken Sipariş Tarihi bilgisi faturanın hangi özel kod alanından alınsın ?,Edit,,txt,,,,,,,,390,,,,,,
PosFis,EFPreScreen,Evet,E-Arşiv/E-Fatura Fatura Ön izlemesi otomatik olarak yapılsın mı? ,ComboBox,Evet&Hayir,,,,,,,,,391,,,,,,
PosFis,EFYBOtoTaslak,Evet,TaxFree kaydedildiğinde otomatik e-fatura taslağı oluşturmak istiyor musunuz?,ComboBox,Evet&Hayir,,,,,,,,,407,,,,,,
PosFis,eksistock,Evet,Eksi(-) ye düşen ürünü satarken uyarı versin mi?,ComboBox,Evet&Hayir,,,,,,,,,428,,,,,,
PosFis,eksistock2,Hayir,Eksi(-) ye düşen ürünün satışına izin versin mi?,ComboBox,Evet&Hayir,,,,,,,,,431,,,,,,
PosFis,ETDagitimYontem,Tümü,E-Ticaret satışlarının dağıtımında izlenecek mağaza seçim yöntemi?,ComboBox,Tümü&PPR,,,,,,,,,447,,,,,,
PosFis,ETOdTip,,E-Ticaret Lokasyonundan alınan satışların ödeme tipi,Edit,,txt,,,,,,,,448,,,,,,
PosFis,FiyatsizPos,Evet,Fiyatsız ürün eklenebilsin mi?,ComboBox,Evet&Hayir,,,,,,,,,473,,,,,,
PosFis,FiyTipSor,Hayir,Birden fazla fiyatı olan ürünler için fiyat sorulsun mu?,ComboBox,Evet&Hayir,,,,,,,,,480,,,,,,
PosFis,FytConvert,Evet,Ürünlerin fiyatı fişin aktif kuruna çevrilsin mi?,ComboBox,Evet&Hayir,,,,,,,,,491,,,,,,
PosFis,GizliETLocation,,Gizli E-Ticaret Lokasyonu,Edit,,txt,,,,,,,,502,,,,,,
PosFis,HedCekFatDizayn,<Default>,Hediye Çeki fatura çıktısının alınacağı dizayn,Edit,,txt,,,,,,,,550,,,,,,
PosFis,HedCekKayYaz,Hayir,Kaydetmeden hediye çeki yazdırılabilsin mi?,ComboBox,Evet&Hayir,,,,,,,,,551,,,,,,
PosFis,iabarkodGizle,Hayir,İade işleminde barkod alanı gizlensin mi?,ComboBox,Evet&Hayir,,,,,,,,,584,,,,,,
PosFis,iadeAutoBelgeNo,Hayir,İade ekranında Belge numarası otomatik arttırımı kapatılsın mı?,ComboBox,Evet&Hayir,,,,,,,,,585,,,,,,
PosFis,iadeStokYetki,Hayir,İade işleminde ürün lokasyona yetkilendirilsin mi?,ComboBox,Evet&Hayir,,,,,,,,,587,,,,,,
PosFis,iskDef,,Perakende satış için varsayılan iskonto tipinin kodu,Edit,,txt,,,,,,,,596,,,,,,
PosFis,Kalemisk,Evet,Kalem iskonto görünsün mü?,ComboBox,Evet&Hayir,,,,,,,,,603,,,,,,
PosFis,Kalemkdv,Evet,Kalem KDV görünsün mü?,ComboBox,Evet&Hayir,,,,,,,,,607,,,,,,
PosFis,KapiBelNo,Hayir,Kapora iade işleminde kapora işleminin belge numarası kullanılsın mı?,ComboBox,Evet&Hayir,,,,,,,,,612,,,,,,
PosFis,KaporaFatDizayn,<Default>,Kaporalı satış fatura çıktısının alınacağı dizayn,Edit,,txt,,,,,,,,613,,,,,,
PosFis,KaporaiadeFatDizayn,<Default>,Kapora iade fatura çıktısının alınacağı dizayn,Edit,,txt,,,,,,,,614,,,,,,
PosFis,KaporaTumLok,Hayir,Kaporadan bul ekranında tüm lokasyonlardaki kaporalı satışlar görünsün mü?,ComboBox,Evet&Hayir,,,,,,,,,615,,,,,,
PosFis,KapSatChg,Evet,Kaporadan alınan satışın satıcı kodu değiştirilebilsin mi?,ComboBox,Evet&Hayir,,,,,,,,,616,,,,,,
PosFis,MaxHarNo,0,1 işlem fişi içinde ki maksimum satır sayısı,Edit,,num,,,,,,,,718,,,,,,
PosFis,MinKaporaOran,0,Kabul edilecek minimum kapora oranı (% olarak),Edit,,num,,,,,,,,750,,,,,,
PosFis,MinTarih,0,Perakende satış yönetimi için en eski bilgi kaç günlük olsun?,Edit,,num,,,,,,,,751,,,,,,
PosFis,MinTarih2,0,Perakende satış Ekranı için en eski bilgi kaç günlük olsun?,Edit,,num,,,,,,,,752,,,,,,
PosFis,MngAdres,,Mng Kargo Alıcı Adres Bilgisini Hangi Özelkod dan Alsın? ör:Ozkod1,Edit,,txt,,,,,,,,765,,,,,,
PosFis,MngAlSms,,Mng Kargo Alıcı  İçin Sms Gönderme Bilgisi Özelkod dan Alsın? ör:Ozkod1,Edit,,txt,,,,,,,,766,,,,,,
PosFis,MngBarcode,ozkod1,Mng Kargo nun Barkod Bilgisi Hangi Özel Kod a Yazılsın?,Edit,,txt,,,,,,,,767,,,,,,
PosFis,MngBarkodType,EPL,Mng son barkodu türü ne olsun?,ComboBox,EPL&ZPL,,,,,,,,,768,,,,,,
PosFis,MngGnSms,,Mng Kargo Gönderici için Sms Gönderme Bilgisini Özelkod dan Alsın? ör:Ozkod1,Edit,,txt,,,,,,,,769,,,,,,
PosFis,MngHataRefBarkod,Evet,Nihai Kargo barkodunun basılamadığı durumlarda referans barkodu basılsın mı?,ComboBox,Evet&Hayir,,,,,,,,,770,,,,,,
PosFis,MngHizmet,,Mng Kargo Gönderi Hizmet Şeklini hangi Özelkod dan alsın,Edit,,txt,,,,,,,,771,,,,,,
PosFis,Mngilce,,Mng Kargo Alıcı İlçe Kodunun Bilgisini Hangi Özelkod dan Alsın? ör:Ozkod1,Edit,,txt,,,,,,,,772,,,,,,
PosFis,MngMail,,Mng Kargo Alıcı Mail Bilgisini Hangi Özelkod dan Alsın? ör:Ozkod1,Edit,,txt,,,,,,,,773,,,,,,
PosFis,MngMusteriNo,,Mng Kargo nun Size Vermiş Olduğu Musteri Numarasını Biliyorsanız Giriniz,Edit,,txt,,,,,,,,774,,,,,,
PosFis,MngOdeSekli,Gönderici Ödemeli,Mng Kargo Ödeme Şekli Ne Olsun?,ComboBox,Gönderici Ödemeli&Alıcı Ödemeli,,,,,,,,,775,,,,,,
PosFis,MngPass,,Mng Kargo nun Size Vermiş Olduğu Şifreyi Giriniz,Edit,,txt,,,,,,,,776,,,,,,
PosFis,MngPDesi,,Mng Kargo Parça Desi Bilgisi Stok Kartındaki Hangi Özelkod dan Alsın? ör:Ozkod1,Edit,,txt,,,,,,,,777,,,,,,
PosFis,MngPKgDesi,,Mng Kargo Parça Kilogram-Desi Büyük Olanın Bilgisi Stok Kartındaki hangi Özelkod dan Alsın? ör:Ozkod1,Edit,,txt,,,,,,,,778,,,,,,
