Modul,MOption,CheckValue,Tanim,Typex,Valuex,EditTypeX,PWinCaption,PTable,PRField,PRFields,PRFieldsValues,Katalog,PassChar,kgid,insUN,insDT,insApp,updUN,updDT,updApp
PosFis,MngPKilo,,Mng Kargo Parça Kilogram Bilgisi Stok Kartındaki hangi Özelkod dan Alsın? ör:Ozkod1,Edit,,txt,,,,,,,,779,,,,,,
PosFis,MngSehir,,Mng Kargo Alıcı Şehir Kodunun Bilgisini Hangi Özelkod dan Alsın? ör:Ozkod1,Edit,,txt,,,,,,,,780,,,,,,
PosFis,MngSiparisOlusum,Hayir,Mng Kargo siparişi başka firmadan mı oluşuyor ?,ComboBox,Evet&Hayir,,,,,,,,,781,,,,,,
PosFis,MngSipNo,,Mng Kargo Sipariş Numrasını nereden Alsın? ör:SatNo,Edit,,txt,,,,,,,,782,,,,,,
PosFis,MngSonBarkod,Hayir,Mng Kargo son barkod oluşturulabilsin mi ?,ComboBox,Evet&Hayir,,,,,,,,,783,,,,,,
PosFis,MngSonSipNo,,Mng Kargo son barkod için sipariş numarasını  hangi özelkod dan alsın? ör:Ozkod1,Edit,,txt,,,,,,,,784,,,,,,
PosFis,MngTel,,Mng Kargo Alıcı Telefon Bilgisini Hangi Özelkod dan Alsın? ör:Ozkod1,Edit,,txt,,,,,,,,785,,,,,,
PosFis,MngTeslimSekli,,Mng Kargo Gönderi Teslimant Şekli Hangi Ozelkod dan Alsın ,Edit,,txt,,,,,,,,786,,,,,,
PosFis,MngUser,,Mng Kargo nun Size Vermiş Olduğu Kullanıcı Adını Giriniz,Edit,,txt,,,,,,,,787,,,,,,
PosFis,mOdeme,Hayir,Ödeme tipi sabit getirilsin mi?,ComboBox,Evet&Hayir,,,,,,,,,793,,,,,,
PosFis,mOdemeiadeTip,GP,İade işlemlerinde kullanılacak ödeme kodu,Edit,,txt,,,,,,,,794,,,,,,
PosFis,mOdemeTip,N,Varsayılan ödeme kodu,Edit,,txt,,,,,,,,795,,,,,,
PosFis,MuAraField,MusteriAdi,Müşteri seçiminde 1.sırada hangi alan olsun?,ComboBox,MusteriAdi&MusteriKodu&UyeNo&TCKimlikNo&EvTel&CepTel,,,,,,,,,824,,,,,,
PosFis,MusBrAlan,MusteriKodu,Müşteri barkodu ile birlikte okutulan alan?,ComboBox,MusteriKodu&UyeNo,,,,,,,,,836,,,,,,
PosFis,MusteriKriter,İzin Ver,Kredisini aşmış müşteri için taksitlendirme yapılsın mı?,ComboBox,İzin Ver&Uyar&Engelle,,,,,,,,,839,,,,,,
PosFis,NCRCodeOzKod,,NCR Aktarımlarındaki CODE alanına yazılacak değerin alınacağını OzKod No,Edit,0,txt,,,,,,,,846,,,,,,
PosFis,NCRFiyTip1,,NCR'a ürün gönderiminde gönderilecek 1. Fiyat Tipinin Kodu:,Edit,,txt,,,,,,,,847,,,,,,
PosFis,NCRFiyTip2,,NCR'a ürün gönderiminde gönderilecek 2. Fiyat Tipinin Kodu:,Edit,,txt,,,,,,,,848,,,,,,
PosFis,NCRFiyTip3,,NCR'a ürün gönderiminde gönderilecek 3. Fiyat Tipinin Kodu:,Edit,,txt,,,,,,,,849,,,,,,
PosFis,NCRFiyTip4,,NCR'a ürün gönderiminde gönderilecek 4. Fiyat Tipinin Kodu:,Edit,,txt,,,,,,,,850,,,,,,
PosFis,NCRFiyTip5,,NCR'a ürün gönderiminde gönderilecek 5. Fiyat Tipinin Kodu:,Edit,,txt,,,,,,,,851,,,,,,
PosFis,needMu_,Evet,Müşteri girişi yapılsın mı?,ComboBox,Evet&Hayir,,,,,,,,,852,,,,,,
PosFis,needMus,Hayir,Müşteri kaydı yapılmadan fiş kaydedilebilsin mi?,ComboBox,Evet&Hayir,,,,,,,,,853,,,,,,
PosFis,needSatici_,Evet,Satıcı girişi yapılsın mı?,ComboBox,Evet&Hayir,,,,,,,,,854,,,,,,
PosFis,nonFat,Evet,Faturasız satış yapılabilsin mi?,ComboBox,Evet&Hayir,,,,,,,,,876,,,,,,
PosFis,OdeCheck,Evet,Ödeme tamamlanmak zorunda mı?,ComboBox,Evet&Hayir,,,,,,,,,920,,,,,,
PosFis,OdemeTipiOnay,Hayir,Ödeme tipi seçildiğinde onay sorusu sorulsun mu?,ComboBox,Evet&Hayir,,,,,,,,,925,,,,,,
PosFis,OdeTipiskFull,Hayir,Ödeme Tipi iskontosu sadece tek seferde ödemede geçerli olsun mu?,ComboBox,Evet&Hayir,,,,,,,,,927,,,,,,
PosFis,OdeVeresiye,Evet,Ödeme farkı veresiye işlesin mi?,ComboBox,Evet&Hayir,,,,,,,,,928,,,,,,
PosFis,OdeVereTip,V,Veresiye ödeme kodu,Edit,,txt,,,,,,,,929,,,,,,
PosFis,OldFisKasi,Hayir,Eski fiş çağırırken kasiyer kontrolü olsun mu?,ComboBox,Evet&Hayir,,,,,,,,,931,,,,,,
PosFis,OneAddstock,Hayir,Barkod ile eklenen aynı stoklar toplansın mı?,ComboBox,Evet&Hayir,,,,,,,,,933,,,,,,
PosFis,OPCChange,Evet,Ödeme ekranında para cinsi değiştirilebilsin mi?,ComboBox,Evet&Hayir,,,,,,,,,935,,,,,,
PosFis,OtoMuhKapora,Hayir,Kaporalı satışlar otomatik muhasebeleşsin mi?,ComboBox,Evet&Hayir,,,,,,,,,942,,,,,,
PosFis,OtoMuhKaporai,Hayir,Kapora iadesi otomatik muhasebeleşsin mi?,ComboBox,Evet&Hayir,,,,,,,,,943,,,,,,
PosFis,OzKod10Tanim,Özel Kod 10,Perakende Özel Kod 10 in tanımı,Edit,,txt,,,,,,,,967,,,,,,
PosFis,OzKod11Tanim,Özel Kod 11,Perakende Özel Kod 11 in tanımı,Edit,,txt,,,,,,,,969,,,,,,
PosFis,OzKod12Tanim,Özel Kod 12,Perakende Özel Kod 12 in tanımı,Edit,,txt,,,,,,,,971,,,,,,
PosFis,OzKod13Tanim,Özel Kod 13,Perakende Özel Kod 13 in tanımı,Edit,,txt,,,,,,,,973,,,,,,
PosFis,OzKod14Tanim,Özel Kod 14,Perakende Özel Kod 14 in tanımı,Edit,,txt,,,,,,,,975,,,,,,
PosFis,OzKod15Tanim,Özel Kod 15,Perakende Özel Kod 15 in tanımı,Edit,,txt,,,,,,,,977,,,,,,
PosFis,OzKod16Tanim,Özel Kod 16,Perakende Özel Kod 16 in tanımı,Edit,,txt,,,,,,,,979,,,,,,
PosFis,OzKod17Tanim,Özel Kod 17,Perakende Özel Kod 17 in tanımı,Edit,,txt,,,,,,,,981,,,,,,
PosFis,OzKod18Tanim,Özel Kod 18,Perakende Özel Kod 18 in tanımı,Edit,,txt,,,,,,,,983,,,,,,
PosFis,OzKod19Tanim,Özel Kod 19,Perakende Özel Kod 19 in tanımı,Edit,,txt,,,,,,,,985,,,,,,
PosFis,OzKod1Tanim,Özel Kod 1,Perakende Özel Kod 1 in tanımı,Edit,,txt,,,,,,,,986,,,,,,
PosFis,OzKod20Tanim,Özel Kod 20,Perakende Özel Kod 20 in tanımı,Edit,,txt,,,,,,,,996,,,,,,
PosFis,OzKod2Tanim,Özel Kod 2,Perakende Özel Kod 2 in tanımı,Edit,,txt,,,,,,,,1006,,,,,,
PosFis,OzKod3Tanim,Özel Kod 3,Perakende Özel Kod 3 in tanımı,Edit,,txt,,,,,,,,1025,,,,,,
PosFis,OzKod4Tanim,Özel Kod 4,Perakende Özel Kod 4 in tanımı,Edit,,txt,,,,,,,,1044,,,,,,
PosFis,OzKod5Tanim,Özel Kod 5,Perakende Özel Kod 5 in tanımı,Edit,,txt,,,,,,,,1054,,,,,,
PosFis,OzKod6Tanim,Özel Kod 6,Perakende Özel Kod 6 in tanımı,Edit,,txt,,,,,,,,1061,,,,,,
PosFis,OzKod7Tanim,Özel Kod 7,Perakende Özel Kod 7 in tanımı,Edit,,txt,,,,,,,,1068,,,,,,
PosFis,OzKod8Tanim,Özel Kod 8,Perakende Özel Kod 8 in tanımı,Edit,,txt,,,,,,,,1075,,,,,,
PosFis,OzKod9Tanim,Özel Kod 9,Perakende Özel Kod 9 in tanımı,Edit,,txt,,,,,,,,1082,,,,,,
PosFis,Par_PosFis_SBBNoSart,Hayir,Satıştan Bul ekranında Belge No girilmesi zorunlu olsun mu?,ComboBox,Evet&Hayir,,,,,,,,,1085,,,,,,
PosFis,Par_PosFis_SBKriterSart,Hayir,Satıştan Bul ekranında kriter girilmesi zorunlu olsun mu?,ComboBox,Evet&Hayir,,,,,,,,,1086,,,,,,
PosFis,Par_YurticiTahsilSekli,Aynı Fatura,Yurtiçi Kargo Tahsilat Şekli Ne Olsun?,ComboBox,Aynı Fatura&Farklı Fatura,,,,,,,,,1088,,,,,,
PosFis,ParaUstuQry,Evet,Paraüstü kasaya işlemeden önce sorulsun mu?,ComboBox,Evet&Hayir,,,,,,,,,1089,,,,,,
PosFis,PeriadeRequired,Hayir,İade işlemlerinde iade nedeni girilmek zorunda mı?,ComboBox,Evet&Hayir,,,,,,,,,1093,,,,,,
PosFis,PerOzSatFiyat,,Perakende satış için varsayılan satış fiyat tipinin Kodu,Edit,,txt,,,,,,,,1096,,,,,,
PosFis,PiFilTarih,Hayir,Perakende Satış Yönetiminde varsayılan olarak günün tarihi gelsin mi?,ComboBox,Evet&Hayir,,,,,,,,,1101,,,,,,
PosFis,pKapatmaUyari,Evet,Ekranı kapatmadan önce uyarı versin mi?,ComboBox,Evet&Hayir,,,,,,,,,1102,,,,,,
PosFis,PuanUyeNo,Hayir,Müşterinin puan kazanması için üye numarası zorunlu mu?,ComboBox,Evet&Hayir,,,,,,,,,1120,,,,,,
PosFis,QuickMusSel,Hayir,Müşteri seçim ekranı hızlandırılsın mı?,ComboBox,Evet&Hayir,,,,,,,,,1123,,,,,,
PosFis,RapiskinKdv,Evet,Raporda çıkan iskonto KDV dahil iskonto olsun mu?(Perakende Reel iskonto),ComboBox,Evet&Hayir,,,,,,,,,1126,,,,,,
PosFis,RDLineInIsk,Hayir,Raporda çıkan perakende satış detay tutarında iskonto düşülsün mü?,ComboBox,Evet&Hayir,,,,,,,,,1134,,,,,,
PosFis,RDLineInKdv,Evet,Raporda çıkan perakende satış detay fiyatlarından KDV sıyrılsın mı?,ComboBox,Evet&Hayir,,,,,,,,,1135,,,,,,
PosFis,SabitiskBC,Hayir,Sabit iskontolu barkod kullanılsın mı?,ComboBox,Evet&Hayir,,,,,,,,,1154,,,,,,
PosFis,SatAllDep,Hayir,Her personel perakende satış yapabilsin mi?,ComboBox,Evet&Hayir,,,,,,,,,1157,,,,,,
PosFis,SatBulLoc,Evet,Satıştan bulma ekranında lokasyon seçimi olsun mu?,ComboBox,Evet&Hayir,,,,,,,,,1158,,,,,,
PosFis,Satir_SatKod,Hayir,Her satıra farklı satıcı kodu atansın mı?,ComboBox,Evet&Hayir,,,,,,,,,1161,,,,,,
PosFis,SatKodZorunlu,Hayir,Satıcı kodu girilmesi zorunlu olsun mu?,ComboBox,Evet&Hayir,,,,,,,,,1165,,,,,,
PosFis,SatSorPerLine,Hayir,Her ürün barkodundan sonra satıcı sorulsun mu?,ComboBox,Evet&Hayir,,,,,,,,,1172,,,,,,
PosFis,SatTakipMik,Hayir,Mağaza Satış Kasa Takip yazdırında ödeme tiplerinin yanında işlem miktarı görünsün mü?,ComboBox,Evet&Hayir,,,,,,,,,1173,,,,,,
PosFis,SaveOnNew,Evet,Kaydetme işleminden hemen sonra yeni kayıda geçilsin mi?,ComboBox,Evet&Hayir,,,,,,,,,1182,,,,,,
PosFis,SaveOnPrint,Evet,"Kaydetme işleminden hemen sonra ""Yazdır"" sorsun mu?",ComboBox,Evet&Hayir,,,,,,,,,1183,,,,,,
PosFis,SilGoster,Evet,Perakende satırında sil butonu görünsün mü?,ComboBox,Evet&Hayir,,,,,,,,,1200,,,,,,
PosFis,SilNeden,Hayir,Perakende satış silinirken açıklama sorulsun mu?,ComboBox,Evet&Hayir,,,,,,,,,1201,,,,,,
PosFis,SilNedenZor,Hayir,Perakende satış silinirken açıklama girişi zorunlu mu?,ComboBox,Evet&Hayir,,,,,,,,,1202,,,,,,
PosFis,Siraliislem,Evet,Satış işlemleri sıralı gelsin mi?,ComboBox,Evet&Hayir,,,,,,,,,1235,,,,,,
PosFis,SonParaCinsi,Hayir,"Perakende satıştaki aktif kur, son okutulan ürünün fiyat tipindeki kur olarak değişsin?",ComboBox,Evet&Hayir,,,,,,,,,1245,,,,,,
PosFis,SortKod,Hayir,Stok listesi tanıma göre sıralansın mı?,ComboBox,Evet&Hayir,,,,,,,,,1249,,,,,,
PosFis,SuratBarcode,ör:ozkod1,Sürat Kargo nun Barkod bilgisi hangi Özel Kod a yazılsın?,Edit,,txt,,,,,,,,1291,,,,,,
PosFis,SuratOdemeSekli,ör:ozkod1,Sürat Kargo Ödeme Şekli bilgisi hangi Özel Kod a yazılsın?,Edit,,txt,,,,,,,,1292,,,,,,
PosFis,SuratOdemeSekli2,Gönderici Ödemeli,Sürat Kargo Ödeme Şekli Nasıl Olsun?,ComboBox,Gönderici Ödemeli&Alıcı Ödemeli&Özel Koda Yazılsın,,,,,,,,,1293,,,,,,
PosFis,SuratPass,,Sürat Kargo nun Size Vermiş Olduğu Şifreyi Giriniz,Edit,,txt,,,,,,,,1294,,,,,,
PosFis,SuratTeslimSekli,ör:ozkod1,Sürat Kargo Teslim Şekli bilgisi hangi Özel Kod a yazılsın?,Edit,,txt,,,,,,,,1295,,,,,,
PosFis,SuratTeslimSekli2,Adrese Teslim,Sürat Kargo Teslim Şekli Nasıl Olsun?,ComboBox,Adrese Teslim&Şubeden Teslim&Özel Koda Yazılsın,,,,,,,,,1296,,,,,,
PosFis,SuratUser,,Sürat Kargo nun Size Vermiş Olduğu Kullanıcı Kodunu Giriniz,Edit,,txt,,,,,,,,1297,,,,,,
PosFis,TaksitBorctur,Hayir,Ödenmemiş taksitler müşteri borcuna yansısın mı?,ComboBox,Hayir&Evet&Gecikenler,,,,,,,,,1305,,,,,,
PosFis,TanimCheck,Evet,Satış ekranında stok tanımı görünsün mü?,ComboBox,Evet&Hayir,,,,,,,,,1311,,,,,,
PosFis,TaxFreeFatDizayn,<Default>,Tax free fatura çıktısının alınacağı dizayn,Edit,,txt,,,,,,,,1312,,,,,,
PosFis,TaxFrUseOption,Global Blue,Yolcu Beraber(TaxFree) kullanım yöntemi?,ComboBox,Global Blue&Entegrator,,,,,,,,,1313,,,,,,
PosFis,UmoAliAdres,,Ups Alıcı Adres Bilgisini Hangi Özelkod dan Alsın? ör:Ozkod1,Edit,,txt,,,,,,,,1355,,,,,,
PosFis,UmoAliArea,,Ups Alıcı Area Kodunun Bilgisini Hangi Özelkod dan Alsın? ör:Ozkod1,Edit,,txt,,,,,,,,1356,,,,,,
PosFis,UmoAliMail,,Ups Alıcı Mail Bilgisini Hangi Özelkod dan Alsın? ör:Ozkod1,Edit,,txt,,,,,,,,1357,,,,,,
PosFis,UmoAliSehir,,Ups Alıcı Şehir Kodunun Bilgisini Hangi Özelkod dan Alsın? ör:Ozkod1,Edit,,txt,,,,,,,,1358,,,,,,
PosFis,UmoAliTel,,Ups Alıcı Telefon Bilgisini Hangi Özelkod dan Alsın? ör:Ozkod1,Edit,,txt,,,,,,,,1359,,,,,,
PosFis,UmoBarView,Evet,Ups Barkodu Direk Yazıcıya Gönderilsin Mi?,ComboBox,Evet&Hayir,,,,,,,,,1360,,,,,,
PosFis,UmoHeight,,Ups Barkod Yüksekliği Kaç Piksel Olsun?,Edit,,txt,,,,,,,,1361,,,,,,
PosFis,UmoKulNo,,Ups in Size Vermiş Olduğu Kullanıcı Numarasını Giriniz,Edit,,txt,,,,,,,,1362,,,,,,
PosFis,UmoLeftMargin,,Ups Barkodda Soldan Kaç Piksel Boşluk Bırakılsın?,Edit,,txt,,,,,,,,1363,,,,,,
PosFis,UmoMusNo,,Ups in Size Vermiş Olduğu Müşteri Numarasını Giriniz,Edit,,txt,,,,,,,,1364,,,,,,
PosFis,UmoOdeTip,Gönderici Ödemeli,Ups Ödeme Tipi Ne Olsun?,ComboBox,Konsinye&Gönderici Ödemeli&Diğer,,,,,,,,,1365,,,,,,
PosFis,UmoPakTip,Dosya,Ups Paket Tipi Ne Olsun?,ComboBox,Dosya&Koli,,,,,,,,,1366,,,,,,
PosFis,UmoPrinter,,Ups Varsayılan Yazıcı Adını Giriniz.,Edit,,txt,,,,,,,,1367,,,,,,
PosFis,UmoSerTip,Normal Servis,Ups Servis Tipi Ne Olsun?,ComboBox,Normal Servis&Expres Servis,,,,,,,,,1368,,,,,,
PosFis,UmoSifre,,Ups in Size Vermiş Olduğu Şifreyi Giriniz,Edit,,txt,,,,,,,,1369,,,,,,
PosFis,UmoSipNo,,Ups Sipariş Numrasını Hangi Özelkod dan Alsın? ör:Ozkod1,Edit,,txt,,,,,,,,1370,,,,,,
PosFis,UmoTopMargin,,Ups Barkodda Üstten Kaç Piksel Boşluk Bırakılsın?,Edit,,txt,,,,,,,,1371,,,,,,
PosFis,UmoWidth,,Ups Barkod Uzunluğu Kaç Piksel Olsun?,Edit,,txt,,,,,,,,1372,,,,,,
PosFis,UniFreeArrival,,UniFree arrival havayolu kısa kodu hangi ödeme özel kodundan alınsın? ör:Ozkod1,Edit,,txt,,,,,,,,1373,,,,,,
PosFis,UniFreeBebekMi,,UniFree bebek yolcu bilgisi hangi ödeme özel kodundan alınsın? ör:Ozkod1,Edit,,txt,,,,,,,,1374,,,,,,
PosFis,UniFreeBolgeKodu,,UniFree gümrük bölge kodu hangi lokasyon özel kodundan alınsın? ör:Ozkod1,Edit,,txt,,,,,,,,1375,,,,,,
PosFis,UniFreeCocukMu,,UniFree çocuk yolcu bilgisi hangi ödeme özel kodundan alınsın? ör:Ozkod1,Edit,,txt,,,,,,,,1376,,,,,,
PosFis,UniFreeDeparture,,UniFree departure havayolu bilgisi hangi ödeme özel kodundan alınsın? ör:Ozkod1,Edit,,txt,,,,,,,,1377,,,,,,
PosFis,UniFreeFirmaKodu,,UniFree gümrük firma kodu hangi lokasyon özel kodundan alınsın? ör:Ozkod1,Edit,,txt,,,,,,,,1378,,,,,,
PosFis,UniFreeHavFirmasi,,UniFree havayolu şirket bilgisi hangi ödeme özel kodundan alınsın? ör:Ozkod1,Edit,,txt,,,,,,,,1379,,,,,,
PosFis,UniFreeID,,UniFree için oluşturulan ID bilgisi hangi ödeme özel koduna yazılsın? ör:Ozkod1,Edit,,txt,,,,,,,,1380,,,,,,
PosFis,UniFreeIGAKomGrubKod,,UniFree IGA komisyon grup kodu,Edit,,txt,,,,,,,,1381,,,,,,
PosFis,UniFreeKomGrubKod,,UniFree komisyon grup kodu,Edit,,txt,,,,,,,,1382,,,,,,
PosFis,UniFreeMagazaKodu,,UniFree gümrük mağaza kodu hangi lokasyon özel kodundan alınsın? ör:Ozkod1,Edit,,txt,,,,,,,,1383,,,,,,
PosFis,UniFreeMilliyetBil,,UniFree milliyet bilgisi hangi ödeme özel kodundan alınsın? ör:Ozkod1,Edit,,txt,,,,,,,,1384,,,,,,
PosFis,UniFreePassYolTip,,UniFree pasaport yolcu tipi hangi ödeme özel kodundan alınsın? ör:Ozkod1,Edit,,txt,,,,,,,,1385,,,,,,
PosFis,UniFreeSifre,,UniFree gümrük şifresi hangi lokasyon özel kodundan alınsın? ör:Ozkod1,Edit,,txt,,,,,,,,1386,,,,,,
PosFis,UniFreeStoreID,,UniFree mağaza numarası hangi lokasyon özel kodundan alınsın? ör:Ozkod1,Edit,,txt,,,,,,,,1387,,,,,,
PosFis,UniFreeUcusNo,,UniFree 4 haneli uçuş kodu hangi ödeme özel kodundan alınsın? ör:Ozkod1,Edit,,txt,,,,,,,,1388,,,,,,
PosFis,UniqBelNo,Evet,Fiş kaydedilirken aynı belge numaralı başka bir fiş varsa kayıta izin versin mi?,ComboBox,Evet&Hayir,,,,,,,,,1389,,,,,,
PosFis,VERA_NakitOT,N,Nakit ödeme tipinin kodu,Edit,,txt,,,,,,,,1420,,,,,,
PosFis,VisAsBCUse,Hayir,Perakende satış ekranında Asorti barkoduyla satış yapılabilsin mi?,ComboBox,Evet&Hayir,,,,,,,,,1422,,,,,,
PosFis,VisGrf,Hayir,Gayri Resmi Fatura Seçim opsiyonu görünsün mü?,ComboBox,Evet&Hayir,,,,,,,,,1424,,,,,,
PosFis,VisLstia,Hayir,Perakende satış ödeme ekranında müşterinin son iadeleri görünsün mü?,ComboBox,Evet&Hayir,,,,,,,,,1425,,,,,,
PosFis,VisSevkTar,Hayir,Fiili Sevk Tarihi Görünsün mü?,ComboBox,Evet&Hayir,,,,,,,,,1426,,,,,,
PosFis,YazKasaQry,Hayir,Yazdırılmayan satışlarda kaydederken yazarkasa sorsun mu?,ComboBox,Evet&Hayir,,,,,,,,,1436,,,,,,
PosFis,YurticiAdres,,Yurtiçi Kargo Alıcı Adres Bilgisini Hangi Özelkod dan Alsın? ör:Ozkod1,Edit,,txt,,,,,,,,1446,,,,,,
PosFis,YurticiAdrID,,Yurtiçi Kargo nun Size Vermiş Olduğu Müşteri Adres ID sini Giriniz ,Edit,,txt,,,,,,,,1447,,,,,,
PosFis,YurticiBarcode,ör:ozkod1,Yurtiçi Kargo nun Barkod bilgisi hangi Özel Kod a yazılsın?,Edit,,txt,,,,,,,,1448,,,,,,
PosFis,YurticiBarView,Evet,Yurtiçi Barkodu Direk Yazıcıya Gönderilsin Mi?,ComboBox,Evet&Hayir,,,,,,,,,1449,,,,,,
PosFis,YurticiCustID,,Yurtiçi Kargo nun Size Vermiş Olduğu Müşteri ID sini Giriniz ,Edit,,txt,,,,,,,,1450,,,,,,
PosFis,YurticiInvoice,,Yurtiçi Kargo Fatura Numrasını nereden Alsın? ör:SatNo,Edit,,txt,,,,,,,,1451,,,,,,
PosFis,Yurticiilce,,Yurtiçi Kargo Alıcı İlçe Kodunun Bilgisini Hangi Özelkod dan Alsın? ör:Ozkod1,Edit,,txt,,,,,,,,1452,,,,,,
PosFis,YurticiLang,TR,Yurtiçi Kargo yu hangi dilde kullanıyorsunuz ,Edit,,txt,,,,,,,,1453,,,,,,
PosFis,YurticiMail,,Yurtiçi Kargo Alıcı Mail Bilgisini Hangi Özelkod dan Alsın? ör:Ozkod1,Edit,,txt,,,,,,,,1454,,,,,,
PosFis,YurticiPass,,Yurtiçi Kargo nun Size Vermiş Olduğu Şifreyi Giriniz,Edit,,txt,,,,,,,,1455,,,,,,
PosFis,YurticiPassTahsilatli,,Yurtiçi Kargo nun Size Vermiş Olduğu Tahsilatlı Şifreyi Giriniz,Edit,,txt,,,,,,,,1456,,,,,,
PosFis,YurticiSehir,,Yurtiçi Kargo Alıcı Şehir Kodunun Bilgisini Hangi Özelkod dan Alsın? ör:Ozkod1,Edit,,txt,,,,,,,,1457,,,,,,
PosFis,YurticiSehirIlce,Evet,Yurtiçi Kargo Şehir ve İlçeyi Özel Kodlardan Alsın mı? ,ComboBox,Evet&Hayir,,,,,,,,,1458,,,,,,
PosFis,YurticiSipNo,,Yurtiçi Kargo Sipariş Numrasını Hangi Özelkod dan Alsın? ör:Ozkod1,Edit,,txt,,,,,,,,1459,,,,,,
PosFis,YurticiTel,,Yurtiçi Kargo Alıcı Telefon Bilgisini Hangi Özelkod dan Alsın? ör:Ozkod1,Edit,,txt,,,,,,,,1460,,,,,,
PosFis,YurticiUser,,Yurtiçi Kargo nun Size Vermiş Olduğu Kullanıcı Kodunu Giriniz,Edit,,txt,,,,,,,,1461,,,,,,
PosFis,YurticiUserTahsilatli,,Yurtiçi Kargo nun Size Vermiş Olduğu Tahsilatlı Kullanıcı Kodunu Giriniz,Edit,,txt,,,,,,,,1462,,,,,,
SipFis,AddOpField,,Sipariş ekranında görmek istediğiniz ilave stok alanı,Edit,,txt,,,,,,,,12,,,,,,
SipFis,AddOpFieldC,,Sipariş ekranında görmek istediğiniz ilave stok alanının tanımı,Edit,,txt,,,,,,,,14,,,,,,
SipFis,AddOpFieldS,,Sipariş ekranında görmek istediğiniz ilave stok alanının özel 1 durumu,Edit,,txt,,,,,,,,16,,,,,,
SipFis,AddOpFieldS1,,Sipariş ekranında görmek istediğiniz ilave stok alanının özel 2 durumu,Edit,,txt,,,,,,,,18,,,,,,
SipFis,AddOpFieldS2,,Sipariş ekranında görmek istediğiniz ilave stok alanının özel 3 durumu,Edit,,txt,,,,,,,,20,,,,,,
SipFis,AdressListVisible,Hayir,Sipariş ekranlarında eski fiş çağırır iken sipariş Adres ve 2.adres tanımları listelensin mi?,ComboBox,Evet&Hayir,,,,,,,,,24,,,,,,
SipFis,AfterMDPUpdate,Sor,MDP Sonrası veri güncellemesi ,ComboBox,Evet&Hayir&Sor,,,,,,,,,35,,,,,,
SipFis,AfterSaveSetLot,Hayir,Sipariş kaydedildikten sonra tüm satırlara otomatik lot ataması yapılsın mı?,ComboBox,Evet&Hayir,,,,,,,,,36,,,,,,
SipFis,AllLocation,Hayir,Pazarlama/Satınalma ekranındaki fiş listesinde tüm lokasyonlardaki pazarlama/satınalma görünsün mü?,ComboBox,Evet&Hayir,,,,,,,,,40,,,,,,
SipFis,ASipRefresh,Hayir,Satınalma Sipariş veya Teklif de sağ tuş ile siparişe gönder işleminden sonra ekran yenilensin mi ? ,ComboBox,Evet&Hayir,,,,,,,,,52,,,,,,
SipFis,ASKdvDahil,Hayir,Satın Alma Siparişlerinde Kdv dahil mi?,ComboBox,Evet&Hayir,,,,,,,,,53,,,,,,
SipFis,AutoBelgeNo,Evet,belge numarası otomatik artsın mı?,ComboBox,Evet&Hayir,,,,,,,,,58,,,,,,
SipFis,AutoSevket,Hayir,"Dahili siparişlerin kaydetme işleminde ""Sevket"" işlemi otomatik çalışsın mı?",ComboBox,Evet&Hayir,,,,,,,,,74,,,,,,
SipFis,AutoTip,EnBuyukNo,Belge numarası otomatik arttırılırken hangi kayıt üzerinden işlem yapılsın?,ComboBox,EnBuyukNo&SonNo,,,,,,,,,82,,,,,,
SipFis,AvSenetTek,Hayir,Pazarlama siparişlerinde siparişe sadece 1 senet bordrosu avans olarak bağlanabilsin?,ComboBox,Evet&Hayir,,,,,,,,,83,,,,,,
SipFis,BagKontrolSil,Uyarsın,Sipariş ve Teklif te silme işleminden önce bağlantılı sipariş var ise ne yapsın ?,ComboBox,Uyarsın&Engellesin&Kontrol etmesin,,,,,,,,,100,,,,,,
SipFis,BcinUseSipLn,0,Siparişte hazırlanan barkod içindeki sipariş numarası baştan kaç karakter olsun?,Edit,,num,,,,,,,,121,,,,,,
SipFis,BcMikEkran,Hayir,Siparişten barkod hazırlanırken miktar bölme ekranı çıksın mı?,ComboBox,Evet&Hayir,,,,,,,,,126,,,,,,
SipFis,BCNewSatir,Hayir,Fişte okutulan her barkod yeni satıra yazılsın mı?,ComboBox,Evet&Hayir,,,,,,,,,129,,,,,,
SipFis,BCOpNewStr,Hayir,Fişte okutulan barkodlar birleştirilirken eski girişlerin üzerine birleştirme yapılsın mı ?,ComboBox,Evet&Hayir,,,,,,,,,131,,,,,,
SipFis,BCRePrinted,Hayir,Sipariş ekranlarında Barkod yazma işlemi tekrarlanırsa onay sorusu sorulsun mu ?,ComboBox,Evet&Hayir,,,,,,,,,132,,,,,,
SipFis,BCRnNewStr,Hayir,Fişte okutulan barkodlar birleştirilirken renk bilgisine göre yeni satıra yazılsın mı?,ComboBox,Evet&Hayir,,,,,,,,,133,,,,,,
SipFis,BelgeNoCheck,Hayir,Belge numarası kontrolü yapılsın mı?,ComboBox,Evet&Hayir,,,,,,,,,142,,,,,,
SipFis,BSipColor,Satinalmalarda,Bağlantılı siparişlerin renklerinin değişmesini ister misiniz ?,ComboBox,Evet&Hayir&Satinalmalarda,,,,,,,,,151,,,,,,
SipFis,btSevketVi,Evet,"Dahili siparişlerde ""Sevket"" tuşu görünsün mü?",ComboBox,Evet&Hayir,,,,,,,,,154,,,,,,
SipFis,CAcKurChgFiyat,Hayir,Stok fiyatı carinin aktif kuruna göre düzenlesin mi?,ComboBox,Evet&Hayir,,,,,,,,,161,,,,,,
SipFis,CariBakvisible,Hayir,Sipariş ekranlarında Cari bakiye seçeneği saklansın mı ?,ComboBox,Evet&Hayir,,,,,,,,,173,,,,,,
SipFis,CekiLocate,Evet,Çeki listesinde satır seçilirse sipariş detayında odaklanma olsun mu?,ComboBox,Evet&Hayir,,,,,,,,,187,,,,,,
SipFis,CKreCheckSi,Hayir,Siparişlerde cari kredi aşımında uyarı versin mi?,ComboBox,Evet&Hayir,,,,,,,,,206,,,,,,
SipFis,CopyBelNo,Evet,Sipariş kopyalamada belge numarasıda kopyalansın mı?,ComboBox,Evet&Hayir,,,,,,,,,209,,,,,,
SipFis,CopyNotlar,Evet,Sipariş kopyalamada notlar da kopyalansın mı?,ComboBox,Evet&Hayır,,,,,,,,,213,,,,,,
SipFis,CopySipTar,Hayir,Kopyalanan Siparişin Tarihi Güncellensin mi?,ComboBox,Evet&Hayir,,,,,,,,,214,,,,,,
SipFis,Cpyisk,Hayir,Sipariş çoğaltmalarda iskonto aktarılsınmı mı?,ComboBox,Evet&Hayir,,,,,,,,,215,,,,,,
SipFis,CrFyOzKOp,Hayir,Carinin fiyatı için Fiyat özelkod1 kullanılıyor.Fiyat Listesini sınırla.,ComboBox,Evet&Hayir,,,,,,,,,217,,,,,,
SipFis,DahirsNo,Hayir,Dah.siparişte yeni irsaliye oluştururken irs no sorsun mu ?,ComboBox,Evet&Hayir,,,,,,,,,235,,,,,,
SipFis,DetailSatirAckCapt,Satır Açıklaması,Sipariş Detaylı Giriş ekranında yer alan Satır açıklaması'nın başlığI ne olsun? ,Edit,Satır Açıklaması,txt,,,,,,,,272,,,,,,
SipFis,DetailScreenField1,Klişe,Sipariş Detaylı Giriş ekranında yer alan 1.üretim alanının başlığı,Edit,Klişe,txt,,,,,,,,273,,,,,,
SipFis,DetailScreenField12,Kutu,Sipariş Detaylı Giriş ekranında yer alan 2.üretim alanının başlığı,Edit,Kutu,txt,,,,,,,,274,,,,,,
SipFis,DetailScreenField13,Koli,Sipariş Detaylı Giriş ekranında yer alan 3.üretim alanının başlığı,Edit,Koli,txt,,,,,,,,275,,,,,,
SipFis,DetailScreenField14,Pelur,Sipariş Detaylı Giriş ekranında yer alan 4.üretim alanının başlığı,Edit,Pelur,txt,,,,,,,,276,,,,,,
SipFis,DetailScreenOtoSearch1,KLISE,Sipariş Detaylı Giriş ekranında yer alan 1.üretim alanını otomatik doldurmada aranacak filtre,Edit,KLISE,txt,,,,,,,,277,,,,,,
SipFis,DetailScreenOtoSearch2,KUTU,Sipariş Detaylı Giriş ekranında yer alan 2.üretim alanını otomatik doldurmada  aranacak filtre,Edit,KUTU,txt,,,,,,,,278,,,,,,
SipFis,DetailScreenOtoSearch3,KOLI,Sipariş Detaylı Giriş ekranında yer alan 3.üretim alanını otomatik doldurmada  aranacak filtre,Edit,KOLI,txt,,,,,,,,279,,,,,,
SipFis,DetailScreenOtoSearch4,PELUR,Sipariş Detaylı Giriş ekranında yer alan 4.üretim alanını otomatik doldurmada  aranacak filtre,Edit,PELUR,txt,,,,,,,,280,,,,,,
SipFis,DetailScreenUrVisible,Hayir,Detaylı Sipariş giriş ekranında üretim özellikleri kullanılsın mı?,ComboBox,Evet&Hayir,,,,,,,,,281,,,,,,
SipFis,Donisk,Hayir,Sipariş dönüştürmelerinde iskonto aktarılsın mı?,ComboBox,Evet&Hayir,,,,,,,,,290,,,,,,
SipFis,DontListClosed,Evet,Sipariş listesinde kapalı siparişleri de göstersin mi?,ComboBox,Evet&Hayir,,,,,,,,,291,,,,,,
SipFis,FastStokList,Hayir,Stok listesi boş açılsın mı?,ComboBox,Evet&Hayir,,,,,,,,,457,,,,,,
SipFis,FiyReadOnly,Hayir,Pazarlama siparişlerinde fiyatlara elle müdahale edilemesin?,ComboBox,Evet&Hayir,,,,,,,,,476,,,,,,
SipFis,FiyTakKont,Hayir,Pazarlama siparişlerinde satır girişlerinde fiyat-taksit kontrolü olsun mu?,ComboBox,Evet&Hayir,,,,,,,,,478,,,,,,
SipFis,GetFullSKod,Evet,Stok listesi aktif lokasyonla mı sınırlansın?,ComboBox,Evet&Hayir,,,,,,,,,500,,,,,,
SipFis,GrpBarCode,Sorsun,Barkod hazırlama şekli nasıl gerçekleştirilsin?,ComboBox,Sorsun&Detay&Gruplu,,,,,,,,,505,,,,,,
SipFis,HarDurum,Evet,Sipariş satırına bağlı olan irsaliye veya fatura silindiğinde kapalı durumu açılsın mı?,ComboBox,Evet&Hayir,,,,,,,,,517,,,,,,
SipFis,HariskChar,   ,Sipariş yazdırda hareket iskontolarının arasına koyulacak karakter,Edit,,txt,,,,,,,,519,,,,,,
SipFis,HSKurCheckit,Hayir,Hizmet Siparişi işlemlerinde girilen kurları göster ve onaylat,ComboBox,Evet&Hayir,,,,,,,,,565,,,,,,
SipFis,IrsAdres,Sipariş Adresi,Sevkiyat tan irsaliye oluşturulduğunda irsaliye hangi adrese oluşturulsun? ,ComboBox,Sipariş Adresi&Sevk Adresi,,,,,,,,,570,,,,,,
SipFis,IslOnaySeviye,0,Siparişten ürün çıkışı yada alımı için gereken onay seviyesi kaç olsun?,ComboBox,0&1&2&3&4&5,,,,,,,,,579,,,,,,
SipFis,Kalemisk,Evet,Kalem iskonto görünsün mü?,ComboBox,Evet&Hayir,,,,,,,,,604,,,,,,
SipFis,Kalemkdv,Evet,Kalem KDV görünsün mü?,ComboBox,Evet&Hayir,,,,,,,,,608,,,,,,
SipFis,KayDurum,Evet,Siparişe bağlı olan irsaliye veya fatura silindiğinde siparişin kapalı durumu açılsın mı?,ComboBox,Evet&Hayir,,,,,,,,,627,,,,,,
