Modul,MOption,CheckValue,Tanim,Typex,Valuex,EditTypeX,PWinCaption,PTable,PRField,PRFields,PRFieldsValues,Katalog,PassChar,kgid,insUN,insDT,insApp,updUN,updDT,updApp
FatFis,UEmirSatAck,SiparisAciklamasi,Üretim bağlantılı fişlerde satır açıklamasına ne yazılsın?,ComboBox,SiparisAciklamasi&EmirNo&SiparisAciklamasi+EmirNo&SiparisBelgeNo+EmirNo&Yok,,,,,,,,,1344,,,,,,
FatFis,YazSortYaz,Hayir,Fatura veya irsaliye yazdırılırken sıralama ekranını çıkarsın mı?,ComboBox,Evet&Hayir,,,,,,,,,1440,,,,,,
FatFis,YuviskTersBas,Hayir,Fatura ve irsaliye çıktısına yuvarlama iskontosunun sayısal değeri -1 ile çarpılıp mı yazılsın?,ComboBox,Evet&Hayir,,,,,,,,,1463,,,,,,
GENEL,AsGosTip,1,Asorti listelerinde detay nasıl gösterilsin?,ComboBox,Gösterilmesin&1&2&3&4&5&6,,,,,,,,,51,,,,,,
GENEL,AsortiBCGen,8,Asorti barkodunda çıkacak bedenler arası genişlik,Edit,,num,,,,,,,,54,,,,,,
GENEL,AsortiSave,Evet,Asorti kullanılsın mı?,ComboBox,Evet&Hayir,,,,,,,,,55,,,,,,
GENEL,BasTar,Hayir,Tarih kriterli alanlarada başlangıç tarihi senenin başı olsun?,ComboBox,Evet&Hayir,,,,,,,,,105,,,,,,
GENEL,BCDefaultDeci,.,Gönderilen barkod dosyalarında çıkmasını istediğiniz desimal separator,Edit,,txt,,,,,,,,108,,,,,,
GENEL,BCDetailSend,Hayir,Barkod gönderiminde detay ekranı açılsın mı?,ComboBox,Evet&Hayir,,,,,,,,,109,,,,,,
GENEL,BcinUseMikLn,5,Fişten hazırlanan barkod içindeki miktar sondan kaç karakterde?,Edit,,num,,,,,,,,112,,,,,,
GENEL,BcinUseMikLnD,3,Fişten hazırlanan barkod içindeki miktar ın Decimal basamak sayısı,Edit,,num,,,,,,,,115,,,,,,
GENEL,BcinUseMikLotLn,1,Fişten hazırlanan barkod içindeki Lot sondan kaç karakterde?,Edit,,num,,,,,,,,118,,,,,,
GENEL,BcMikEkran,Hayir,Fişten barkod hazırlanırken miktar bölme ekranı çıksın mı?,ComboBox,Evet&Hayir,,,,,,,,,125,,,,,,
GENEL,BCSpecProcId,8,Ürünler için belirlenecek özel takip numarasinin barkoda yansıyacak uzunluğu,Edit,,num,,,,,,,,135,,,,,,
GENEL,BedenOzKod1T,Özel Kod 1,Beden Özel Kod 1 Tanımı,Edit,,txt,,,,,,,,138,,,,,,
GENEL,BedenOzKod2T,Özel Kod 2,Beden Özel Kod 2 Tanımı,Edit,,txt,,,,,,,,139,,,,,,
GENEL,BedenOzKod3T,Özel Kod 3,Beden Özel Kod 3 Tanımı,Edit,,txt,,,,,,,,140,,,,,,
GENEL,BiDahaCatalog,Hayir,Bir daha sorma seçeneği katalog bazında çalışsın mı?,ComboBox,Evet&Hayir,,,,,,,,,146,,,,,,
GENEL,CAListSort,CariKod,Cari listesi hangi alana göre sıralı gelsin?,ComboBox,CariKod&CariTanim,,,,,,,,,167,,,,,,
GENEL,CariKaraListe,Uyar,Kara listede olan bir cari seçildiğinde ne olsun?,ComboBox,İzin ver&İzin verme&Uyar,,,,,,,,,175,,,,,,
GENEL,ColorOzKodCnt,Hayir,Renk Tanımlarında mükerrer Özel Kod kontrolü yapılsın mı?,ComboBox,Evet&Hayir,,,,,,,,,208,,,,,,
GENEL,CSListColMUH,Evet,Çek/Senet listelerinde muhasebele işareti gösterilsin mi?,ComboBox,Evet&Hayir,,,,,,,,,218,,,,,,
GENEL,DahsipOnay,Hayir,Dahili siparişlerde siapriş onay sistemine izin verilsin mi ?,ComboBox,Evet&Hayir,,,,,,,,,242,,,,,,
GENEL,DefaultFFormat,"#,###.##",Sayısal alanların formatı,Edit,,txt,,,,,,,,247,,,,,,
GENEL,DefaultPC,TL,Sabit Para Cinsi,Edit,,txt,,,,,,,,252,,,,,,
GENEL,DefaultYuvarla,"0,01",Yuvarlama katsayısı,Edit,,num,,,,,,,,255,,,,,,
GENEL,DefLangId,Otomatik,Programın varsayılan dili ne olsun?,ComboBox,Otomatik&Turkish&English&Russian&Arabic&Persian,,,,,,,,,257,,,,,,
GENEL,DefYuvYon,Hayir,Yuvarlama yönü,ComboBox,Evet&Hayir,,,,,,,,,262,,,,,,
GENEL,DovizUyar,Evet,Program girişinde günlük döviz girişi yapılmadıysa uyarı versin mi?,ComboBox,Evet&Hayir,,,,,,,,,292,,,,,,
GENEL,DPAlphaNumeric,,Dataport hesabı Alfanumeriğiniz?,Edit,,txt,,,,,,,,293,,,,,,
GENEL,DPCustomer,,Dataport hesabı müşteri numaranız?,Edit,,txt,,,,,,,,294,,,,,,
GENEL,DPPassword,,Dataport hesabı şifreniz?,Edit,,txt,,,,,,,*,295,,,,,,
GENEL,DPShortNumber,,Dataport hesabı kısa numaranız?,Edit,,txt,,,,,,,,296,,,,,,
GENEL,DPUsername,,Dataport hesabı kullanıcı adınız?,Edit,,txt,,,,,,,,297,,,,,,
GENEL,EArsiv,Hayir,E-Arşiv kullanıyor musunuz?,ComboBox,Evet&Hayir,,,,,,,,,304,,,,,,
GENEL,EFKatalogBaz,Hayir,E-Fatura parametreleri katalog bazlı olsun mu?,ComboBox,Evet&Hayir,,,,,,,,,367,,,,,,
GENEL,EFLinkModul,p,E-Fatura link gönderimi için hangi modül kullanılsın? (f / p / fp),Edit,,txt,,,,,,,,369,,,,,,
GENEL,ExeMustBuild,,Çalışabilecek tek exe nin versiyonu,Edit,,txt,,,,,,,,450,,,,,,
GENEL,FisiptalAuth,Hayir,Fiş silme yetkisi olmayanlar iptal işaretini kaldırabilsin mi? ,ComboBox,Evet&Hayir,,,,,,,,,471,,,,,,
GENEL,FiyHesDonemBasUse,Hayir,Fiyat hesaplama fonksıyonlarında dönem başlangıç tarıhı önemsensın mı? ,ComboBox,Evet&Hayir,,,,,,,,,474,,,,,,
GENEL,FormRBTekAsorti,Evet,Renk-Beden ekranında F8 işleminde tek asorti varsa asorti listesini getirme,ComboBox,Evet&Hayir,,,,,,,,,481,,,,,,
GENEL,GetAlterKodTip,Hayir,Alternatif kodu getirirken renk-beden için bulanamazsa renksiz-bedensiz olarakta bakılsın mı?,ComboBox,Evet&Hayir,,,,,,,,,499,,,,,,
GENEL,GuncelStokKontrolu,Hayir,Web Servis Kullanımında Tarihe Göre Mevcut Çekilebilsin Mi? ,ComboBox,Evet&Hayir,,,,,,,,,511,,,,,,
GENEL,HBFirmaKod,,Hepsiburada Firma Kodu,Edit,,txt,,,,,,,,545,,,,,,
GENEL,HBOzKod,OzKod1,Hepsiburada satışlarının işaretlendiği özel kod,ComboBox,OzKod1&OzKod2&OzKod3&OzKod4&OzKod5&OzKod6&OzKod7&OzKod8&OzKod9&OzKod10&OzKod11&OzKod12&OzKod13&OzKod14&OzKod15&OzKod16&OzKod17&OzKod18&OzKod19&OzKod20,,,,,,,,,546,,,,,,
GENEL,HBOzKodDeger,hepsiburada,Hepsiburada satışlarının özel koda yazılan değeri,Edit,,txt,,,,,,,,547,,,,,,
GENEL,HBPackageIdOzKod,OzKod4,Hepsiburada satışlarının paket numarasının okunacağı özel kod,ComboBox,OzKod1&OzKod2&OzKod3&OzKod4&OzKod5&OzKod6&OzKod7&OzKod8&OzKod9&OzKod10&OzKod11&OzKod12&OzKod13&OzKod14&OzKod15&OzKod16&OzKod17&OzKod18&OzKod19&OzKod20,,,,,,,,,548,,,,,,
GENEL,Hizmet_GelGid_Sor,Evet,Hizmet kartı ile Gelir-Gider kartı aynı kod lu tanımlanabilsin mi?,ComboBox,Evet&Hayir,,,,,,,,,561,,,,,,
GENEL,KartLocate,Hayir,Kart ekranlarında sıralama yapılırken seçili olana odaklansın mı,ComboBox,Evet&Hayir,,,,,,,,,619,,,,,,
GENEL,KasaFoyuPath,,Kasa Föylerinin Arşivleneceği Klasör Yolu,Edit,,txt,,,,,,,,623,,,,,,
GENEL,KGMessengerCanClose,Evet,KGMessenger kapatılabilsin mı?,ComboBox,Evet&Hayir,,,,,,,,,645,,,,,,
GENEL,KGMessengerip,127.0.0.1,KGMessenger Server Uygulamasının bulunduğu bilgisayarın ip adresi,Edit,,txt,,,,,,,,646,,,,,,
GENEL,KGMessengerPort,1001,KGMessenger için kullanılacak olan port,Edit,,txt,,,,,,,,647,,,,,,
GENEL,KulPuanServis,Hayir,"""Ortak Puan Servisi""ni kullanmak istiyor musunuz?",ComboBox,Evet&Hayir,,,,,,,,,663,,,,,,
GENEL,ListFilter,Evet,Liste ekranı bulma özelliği filtreleme olarak çalışsın mı?,ComboBox,Evet&Hayir,,,,,,,,,669,,,,,,
GENEL,ListRenkUse,Hayir,Liste ekranlarında resim gösterme özelliği aktif olsun mu?,ComboBox,Evet&Hayir,,,,,,,,,670,,,,,,
GENEL,ListSave,Evet,Liste ekranlarındaki değişiklikler kaydedilsin mi?,ComboBox,Evet&Hayir,,,,,,,,,671,,,,,,
GENEL,LocalResimPath,,Uzak Bilgisayar Kullanımı İçin Değişecek Eski Resim Yolu,Edit,,txt,,,,,,,,673,,,,,,
GENEL,LocListSort,Kod,Lokasyon listeleri hangi alana göre sıralansın?,ComboBox,Kod&Tanim,,,,,,,,,675,,,,,,
GENEL,LokOzKod10T,Özel Kod 10,Lokasyon Özel Kod 10 Tanımı,Edit,,txt,,,,,,,,676,,,,,,
GENEL,LokOzKod1T,Özel Kod 1,Lokasyon Özel Kod 1 Tanımı,Edit,,txt,,,,,,,,677,,,,,,
GENEL,LokOzKod2T,Özel Kod 2,Lokasyon Özel Kod 2 Tanımı,Edit,,txt,,,,,,,,678,,,,,,
GENEL,LokOzKod3T,Özel Kod 3,Lokasyon Özel Kod 3 Tanımı,Edit,,txt,,,,,,,,679,,,,,,
GENEL,LokOzKod4T,Özel Kod 4,Lokasyon Özel Kod 4 Tanımı,Edit,,txt,,,,,,,,680,,,,,,
GENEL,LokOzKod5T,Özel Kod 5,Lokasyon Özel Kod 5 Tanımı,Edit,,txt,,,,,,,,681,,,,,,
GENEL,LokOzKod6T,Özel Kod 6,Lokasyon Özel Kod 6 Tanımı,Edit,,txt,,,,,,,,682,,,,,,
GENEL,LokOzKod7T,Özel Kod 7,Lokasyon Özel Kod 7 Tanımı,Edit,,txt,,,,,,,,683,,,,,,
GENEL,LokOzKod8T,Özel Kod 8,Lokasyon Özel Kod 8 Tanımı,Edit,,txt,,,,,,,,684,,,,,,
GENEL,LokOzKod9T,Özel Kod 9,Lokasyon Özel Kod 9 Tanımı,Edit,,txt,,,,,,,,685,,,,,,
GENEL,Mail_Silme,Hayir,Mail silindiğinde geri dönüşüm kutusuna taşınsın mı?,ComboBox,Evet&Hayir,,,,,,,,,693,,,,,,
GENEL,MailPass,,Mail Server SMTP şifreniz,Edit,,txt,,,,,,,*,694,,,,,,
GENEL,MailSMTP,,Mail Server SMTP adresiniz,Edit,,txt,,,,,,,,695,,,,,,
GENEL,MailSMTPPort,587,Mail Server SMTP Port numaranız,Edit,,txt,,,,,,,,696,,,,,,
GENEL,MailUser,,Mail Server SMTP kullanıcı adınız,Edit,,txt,,,,,,,,697,,,,,,
GENEL,MasrafMerkeziGir,Hayir,Masraf dağıtım ekranına girsin mi ?,ComboBox,Evet&Hayir,,,,,,,,,704,,,,,,
GENEL,MasrafOtoDagit,Hayir,Masraf dağıtımını otomatik yapsın mı ?,ComboBox,Evet&Hayir,,,,,,,,,705,,,,,,
GENEL,MATanim,Cinsiyet,Cinsiyet tanımlaması,Edit,,txt,,,,,,,,707,,,,,,
GENEL,MatAsorBc,Evet,Fişler de matrix ekrandan asorti girişi yapılırken eğer barkodu tanımlı değilse tanımlansın mı?,ComboBox,Evet&Hayir,,,,,,,,,708,,,,,,
GENEL,MatRapFontSize,8,Matrix Şeklinde rapor alınırken fontun büyüklüğü ne olsun?,Edit,,num,,,,,,,,709,,,,,,
GENEL,MatRapRGen,20,Matrix Şeklinde rapor alınırken beden alanlarının genişliği kaç pixel olsun?,Edit,,num,,,,,,,,710,,,,,,
GENEL,MatRapRYuk,0,Matrix Şeklinde rapor alınırken renk alanlarının yüksekliği kaç pixel olsun?,Edit,,num,,,,,,,,711,,,,,,
GENEL,MatRapSatTop,Evet,Matrix Şeklinde rapor alınırken satır toplamı yazılsın mı?,ComboBox,Evet&Hayir,,,,,,,,,712,,,,,,
GENEL,MatrisCikFiyDegis,Hayir,Matrix ekran çıkışlarında satır fiyatı güncellensin mi?,ComboBox,Evet&Hayir,,,,,,,,,713,,,,,,
GENEL,MatrixFFormat,"#,##0.##",Matrix Giriş Alanlarının Formatı,Edit,,txt,,,,,,,,714,,,,,,
GENEL,MaxAsorFrmt,700,Otomatik Asorti Barkodu oluşturulurken dikkate alınacak barkod ön-eki,Edit,,txt,,,,,,,,715,,,,,,
GENEL,MaxRezervDay,10,Rezerv Fişlerine verilebilecek en fazla gün,Edit,,num,,,,,,,,719,,,,,,
GENEL,MBTanim,Reyon,Reyon tanımlaması,Edit,,txt,,,,,,,,722,,,,,,
GENEL,MtxBedOrd,BedenKod,Bedenlerin listelendiği ekranlarda ve matrix yazdırmalarda bedenlerin sıralaması ne olsun?,ComboBox,BedenKod&Beden&OzKod1&OzKod2&OzKod3&SiraNo,,,,,,,,,819,,,,,,
GENEL,MtxMevcutGoster,Hayir,Matrix ekranda mevcut gösterilsin mi?,ComboBox,Evet&Hayir,,,,,,,,,821,,,,,,
GENEL,MtxMevcutGosterFrm,Stok Mevcudu,Matrix ekranlarda stok mevcudu hesaplama formülü ne olsun ?,ComboBox,Stok Mevcudu&((Stok Mevcudu+SatınAlma Kalan)-(Pazarlama Sip Kalan)),,,,,,,,,822,,,,,,
GENEL,MtxRenk,Evet,Matrix ekranda bulunulan satır renklendirilsin mi?,ComboBox,Evet&Hayir,,,,,,,,,823,,,,,,
GENEL,MUListSort,HesapKodu,Muhasebe hesap listesi hangi alana göre sıralı gelsin?,ComboBox,HesapKodu&HesapTanim,,,,,,,,,833,,,,,,
GENEL,MultiThreadCount,0,Çoklu işlemlerde işlemciye gönderilecek işlem sayısı (Varsayılan=0),Edit,,num,,,,,,,,834,,,,,,
GENEL,MXTanim,Beden,X ekseninin tanımlaması,Edit,,txt,,,,,,,,842,,,,,,
GENEL,MYTanim,Renk,Y ekseninin tanımlaması,Edit,,txt,,,,,,,,844,,,,,,
GENEL,MYTChtr,Tanim,Y ekseninin karakteristik çalışma şekli,ComboBox,Renk&Tanim,,,,,,,,,845,,,,,,
GENEL,NewBedenCopyAll,Evet,Bu katalogda açılan bedenler tüm kataloglara kopyalansın mı?,ComboBox,Evet&Hayır,,,,,,,,,855,,,,,,
GENEL,NewRenkCopyAll,Evet,Bu katalogda açılan renkler tüm kataloglara kopyalansın mı?,ComboBox,Evet&Hayır,,,,,,,,,856,,,,,,
GENEL,NonResim,,Resimi olmayan stoklar için görüntülenecek resim dosyası,Edit,,txt,,,,,,,,877,,,,,,
GENEL,NoNullPrice,Hayir,Maliyet Fiyat hesaplamalarında Fiyatsız satırları dikkate alma.,ComboBox,Evet&Hayir,,,,,,,,,878,,,,,,
GENEL,NoShowCariList,Evet,Cari listesini göstermeden kart ekranını aç.,ComboBox,Evet&Hayir,,,,,,,,,913,,,,,,
GENEL,NoShowMuhFisList,Evet,Muhasebe Fiş listesini göstermeden fiş ekranını aç.,ComboBox,Evet&Hayir,,,,,,,,,914,,,,,,
GENEL,NoShowStokList,Evet,Stok listesini göstermeden kart ekranını aç.,ComboBox,Evet&Hayir,,,,,,,,,915,,,,,,
GENEL,OtomDovizCek,Hayir,Program açılışında döviz kurları (eğer boş ise) TCMB'den alınsın mı?,ComboBox,Evet&Hayir,,,,,,,,,939,,,,,,
GENEL,OtomLokasyon,Evet,Program açılışında lokasyon seçim listesi açılsın mı?,ComboBox,Evet&Hayir,,,,,,,,,941,,,,,,
GENEL,OtoRezervDay,10,Rezerv Fişlerinin otomatik rezerv günü,Edit,,num,,,,,,,,944,,,,,,
GENEL,OtoWebBr,Evet,Korgun bilgilendirme ekranı otomatik olarak açılsın mı?,ComboBox,Evet&Hayir,,,,,,,,,945,,,,,,
GENEL,OTVKullan,Hayir,Fatura ve Siparişte ÖTV kullanılsın mı?,ComboBox,Evet&Hayir,,,,,,,,,947,,,,,,
GENEL,OTVOran,"6,7",ÖTV Oranı,Edit,,txt,,,,,,,,948,,,,,,
GENEL,Par_CacheMostQry,Hayır,Sık sorgulanan tanımlar hafızada saklansın mı?,ComboBox,Evet&Hayır,,,,,,,,,1083,,,,,,
GENEL,Par_FR_DirName,,Fast Report tasarımlarının kaydedileceği dizin...,Edit,,txt,,,,,,,,1084,,,,,,
GENEL,Par_WindowsCanSleep,Evet,Uyku moduna geçme engellensin mi?,ComboBox,Evet&Hayir,,,,,,,,,1087,,,,,,
GENEL,PencereLocate,Hayir,Pencere ekranı sıralanırken seçili olana odaklansın mı?,ComboBox,Evet&Hayir,,,,,,,,,1091,,,,,,
GENEL,PenColFit,Evet,Pencere ekranı kolon genişlikleri otomatik düzenlensin mi?,ComboBox,Evet&Hayir,,,,,,,,,1092,,,,,,
GENEL,PerOTVKullan,Hayir,Perakende satışta ÖTV kullanılsın mı?,ComboBox,Evet&Hayir,,,,,,,,,1095,,,,,,
GENEL,PGPassword,,Posta Güvercini hesabı şifreniz?,Edit,,txt,,,,,,,*,1099,,,,,,
GENEL,PGUsername,,Posta Güvercini hesabı kullanıcı Adınız?,Edit,,txt,,,,,,,,1100,,,,,,
GENEL,PosUI,Normal,Perakende satış ekran tipi?,ComboBox,Normal&Yeni,,,,,,,,,1106,,,,,,
GENEL,ProjeKullan,Evet,Proje dağıtımı yapılsın mı ?,ComboBox,Evet&Hayir,,,,,,,,,1113,,,,,,
GENEL,PuanServisKull,,"""Ortak Puan Servisi"" firma id?",Edit,,txt,,,,,,,,1118,,,,,,
GENEL,PuanServisSrIp,,"""Ortak Puan Servisi"" adresi?",Edit,,txt,,,,,,,,1119,,,,,,
GENEL,RafWorkType,Lokasyon,Raf Programı Çalışma Tipi,ComboBox,Tümü&Lokasyon&Cari&Müşteri,,,,,,,,,1124,,,,,,
GENEL,RapKriVisi,Yazma,Yönetim raporu yazdırılırken yönetim kriterlerinin yazdırılacağı yer,ComboBox,Yazma&UstAck&AltAck&SinirlamaAck,,,,,,,,,1127,,,,,,
GENEL,RBAsStokMvcd,Evet,Renk-Beden ekranında asorti listesinde stok mevcudu gelsin mi?,ComboBox,Evet&Hayir,,,,,,,,,1129,,,,,,
GENEL,RBAsStokRzv,Evet,Renk-Beden ekranında asorti listesinde Rezerv miktarı gelsin mi?,ComboBox,Evet&Hayir,,,,,,,,,1130,,,,,,
GENEL,RBTEKFYT,*,"Renk-Beden için tek fiyat kullanılsın (Evet için * koyunuz,Hayır için boş bırakınız)",,,txt,,,,,,,,1133,,,,,,
GENEL,RenkOzKod1T,Özel Kod 1,Renk Özel Kod 1 Tanımı,Edit,,txt,,,,,,,,1136,,,,,,
GENEL,RenkOzKod2T,Özel Kod 2,Renk Özel Kod 2 Tanımı,Edit,,txt,,,,,,,,1137,,,,,,
GENEL,RenkOzKod3T,Özel Kod 3,Renk Özel Kod 3 Tanımı,Edit,,txt,,,,,,,,1138,,,,,,
GENEL,ReportDate,Hayir,Raporda filtrede seçilen tarih aralığı bilgisi olsun mu?,ComboBox,Evet&Hayir,,,,,,,,,1139,,,,,,
GENEL,RezervOnay,Hayir,Rezerv sisteminde onay özelliğini kullanmak istiyor musunuz?,ComboBox,Evet&Hayir,,,,,,,,,1143,,,,,,
GENEL,RezMtrxMev,Hayir,Matrix ekranda rezerv miktarı gösterilsin mi?,ComboBox,Evet&Hayir,,,,,,,,,1144,,,,,,
GENEL,ScreenOpenMultiple,Hayir,Fiş ekranları birden fazla açılabilsin mi?,ComboBox,Evet&Hayir,,,,,,,,,1186,,,,,,
GENEL,ScrSvrint,00:00:00,Programın şifre sorması için geçmesi gereken süre (SA:DK:SN) :,Edit,,txt,,,,,,,,1188,,,,,,
GENEL,SendExcel,Yeni,Yönetim Ekranlarındaki Excel e Gönderim Çalışma Şekli.,ComboBox,Yeni&Eski,,,,,,,,,1190,,,,,,
GENEL,SipQueryOption,Tümü,PPR Sorgulama Lokasyon seçeneği ne olsun?,ComboBox,Magaza&Magaza Harici&Tümü,,,,,,,,,1226,,,,,,
GENEL,SipQueryTime,0,PPR Sorgulaması kaç dakikada bir olsun?,Edit,,txt,,,,,,,,1227,,,,,,
GENEL,SKLokBulYet,Hayir,"Stok kartında ""Lokasyonda bulunma yetkisi"" özelliğini kullanmak istiyor musunuz?",ComboBox,Evet&Hayir,,,,,,,,,1236,,,,,,
GENEL,SKLokMikYet,Hayir,"""Lokasyon bazlı miktar bulunma sınırı"" özelliğini kullanmak istiyor musunuz?",ComboBox,Evet&Hayir,,,,,,,,,1237,,,,,,
GENEL,StokUrYet,Hayir,Stok (Üretici) Yetkilendirmeleri aktif olsun mu? ,ComboBox,Evet&Hayir,,,,,,,,,1290,,,,,,
GENEL,TCMBPC,TL,TCMB den kurlar hangi kur üzerinden alınsın,Edit,,txt,,,,,,,,1315,,,,,,
GENEL,ToplamFFormat,"#,##0.##",Fiş Toplam Alanlarının Formatı,Edit,,txt,,,,,,,,1326,,,,,,
GENEL,TopluMuhSilPsw,,Muhasebe fişlerinin toplu silinebilmesi için gerekli olan şifre?,Edit,,txt,,,,,,,*,1328,,,,,,
GENEL,TTAlfaNume,,Turatel alfanumeriğiniz?,Edit,,txt,,,,,,,,1329,,,,,,
GENEL,TTChannelC,,Turatel kanal kodunuz?,Edit,,txt,,,,,,,,1330,,,,,,
GENEL,TTPassword,,Turatel hesabı şifreniz?,Edit,,txt,,,,,,,*,1331,,,,,,
GENEL,TTUsername,,Turatel hesabı kullanıcı Adınız?,Edit,,txt,,,,,,,,1332,,,,,,
GENEL,TYApiKey,,Trendyol Api Key,Edit,,txt,,,,,,,,1335,,,,,,
GENEL,TYApiSecret,,Trendyol Api Secret,Edit,,txt,,,,,,,,1336,,,,,,
GENEL,TYFirmaKod,,Trendyol Firma Kodu,Edit,,txt,,,,,,,,1337,,,,,,
GENEL,TYOzKod,OzKod1,Trendyol satışlarının işaretlendiği özel kod,ComboBox,OzKod1&OzKod2&OzKod3&OzKod4&OzKod5&OzKod6&OzKod7&OzKod8&OzKod9&OzKod10&OzKod11&OzKod12&OzKod13&OzKod14&OzKod15&OzKod16&OzKod17&OzKod18&OzKod19&OzKod20,,,,,,,,,1338,,,,,,
GENEL,TYOzKodDeger,trendyol,Trendyol satışlarının özel koda yazılan değeri,Edit,,txt,,,,,,,,1339,,,,,,
GENEL,TYPackageIdOzKod,OzKod4,Trendyol satışlarının paket numarasının okunacağı özel kod,ComboBox,OzKod1&OzKod2&OzKod3&OzKod4&OzKod5&OzKod6&OzKod7&OzKod8&OzKod9&OzKod10&OzKod11&OzKod12&OzKod13&OzKod14&OzKod15&OzKod16&OzKod17&OzKod18&OzKod19&OzKod20,,,,,,,,,1340,,,,,,
GENEL,UseLang,Hayir,Çoklu dil desteğini kullanmak istiyor musunuz?,ComboBox,Evet&Hayir,,,,,,,,,1410,,,,,,
GENEL,UseRezerv,Hayir,Rezerv sistemini kullanmak istiyor musunuz?,ComboBox,Evet&Hayir,,,,,,,,,1411,,,,,,
GENEL,UzakResimPath,,Uzak Bilgisayar Kullanımı İçin Değişecek Yeni Resim Yolu,Edit,,txt,,,,,,,,1413,,,,,,
GENEL,vCountPassword,,vCount Şifresi,Edit,,txt,,,,,,,,1416,,,,,,
GENEL,vCountUsername,,vCount Kullanıcı adı,Edit,,txt,,,,,,,,1417,,,,,,
GENEL,YonColFit,Hayir,Yönetim ekranları kolon genişlikleri otomatik düzenlensin mi?,ComboBox,Evet&Hayir,,,,,,,,,1443,,,,,,
GENEL,YonGrupsuzTop,Hayir,Yönetim ekranlarında grupsuz toplam önce gelsin,ComboBox,Evet&Hayir,,,,,,,,,1444,,,,,,
GENEL,YonSonKri,Evet,Yönetim ekranlarında son seçilen kriter kaydı gelsin mi?,ComboBox,Evet&Hayir,,,,,,,,,1445,,,,,,
GENEL_gizli,ChangeLogLastkgid,269067,,,,,,,,,,,,197,,,,dbo,2025-05-31 07:15:42.397000,KGEntegrator
GVirman,BorcAlacakKontrol,Evet,Genel Virman işleminde borç-alacak eşitlik kontrolü yapılsın mı?,ComboBox,Evet&Hayir,,,,,,,,,150,,,,,,
GVirman,MFisiptal,Hayir,Genel virman içinde iptal etme özelliği gösterilsin mi?,ComboBox,Evet&Hayir,,,,,,,,,741,,,,,,
GVirman,NoMuhKodSave,Hayir,Fiş kaydı sırasında muhasebe kodu kontrolü sağlansın mı?,ComboBox,Evet&Hayir,,,,,,,,,872,,,,,,
HedCek,HCSKT,,Hediye çeki oluştururken kullanılacak son kullanma tarihi (Tarih (Ör:31/12/2014) veya gün sayısı),Edit,,txt,,,,,,,,549,,,,,,
HedCek,OdTip,,Hediye Çeki Ödeme Tip Kodu,Edit,,txt,,,,,,,,930,,,,,,
HedCek,PFSKT,365,Para fişi verilirken son kullanma tarihi kaç gün sonra olsun?,Edit,,txt,,,,,,,,1098,,,,,,
HedCek,YazCountCont,Evet,"Hediye Çeki yazdırılırken ""önceden yazdırılmış mı"" kontrolü uygulansın mı?",ComboBox,Evet&Hayir,,,,,,,,,1435,,,,,,
Kasa,AutoTip,Dusebilir,Kasanın eksiye düşme durumu ne olsun ?,ComboBox,Dusebilir&Dusemez&DusmesiniSor,,,,,,,,,76,,,,,,
Kasa,EksiyeDussunMiSor,Hayir,Kasa eksiye düşme parametresi genel olsun mu?,ComboBox,Evet&Hayir,,,,,,,,,433,,,,,,
Kasa,KasAcKurSetif,Hayir,Kasa kartlarında aktif kur seçilmeye zorlansın mı?,ComboBox,Evet&Hayir,,,,,,,,,621,,,,,,
Kasa,KasAcKurUse,Hayir,Kasa kartlarında aktif kur kullanılsın mı?,ComboBox,Evet&Hayir,,,,,,,,,622,,,,,,
Kasa,KasaSisTip,BirinciSistem,Kasalar arası transfer sisteminin çalışma şekli hangisi olsun?,ComboBox,BirinciSistem&ikinciSistem,,,,,,,,,625,,,,,,
Kasa,KasaYonDEDahil,Evet,Kasa yönetimine döviz işlemleri dahil edilsin mi?,ComboBox,Evet&Hayir,,,,,,,,,626,,,,,,
KasaFis,AutoBelLoc,Evet,Kasa fişlerinde belge numarası artımı lokasyon bazında olsun mu?,ComboBox,Evet&Hayir,,,,,,,,,64,,,,,,
KasaFis,AutoFatNo,Evet,Kasa fişlerinde belge numarası otomatik artsın mı?,ComboBox,Evet&Hayir,,,,,,,,,70,,,,,,
KasaFis,AutoTip,EnBuyukNo,Kasa fişlerinde belge numarası arttırılırken hangi kayıt üzerinden işlem yapılsın?,ComboBox,EnBuyukNo&SonNo,,,,,,,,,80,,,,,,
KasaFis,BAClosedV,Hayir,Kasa işlemlerinde borç alacak kapatma tuşu görünsün mü?,ComboBox,Evet&Hayir,,,,,,,,,92,,,,,,
KasaFis,BAClosedVAS,Hayir,Kasa işlemlerinde kaydetme işleminden sonra borç alacak kapatma ekranı otomatik çıksın mı?,ComboBox,Evet&Hayir,,,,,,,,,98,,,,,,
KasaFis,DetayKodCheck,Evet,Kasa işlemlerinde detay kodu girme zorunluluğu olsun mu?,ComboBox,Evet&Hayir,,,,,,,,,282,,,,,,
KasaFis,DifLocAccess,Hayir,Kasa işlemlerini görmek için lokasyon yetkisi dikkate alınmasın?,ComboBox,Evet&Hayir,,,,,,,,,288,,,,,,
KasaFis,HarOzKod1,Özel Kod 1,Kasa Fişi Özel Kod 1 in adı,Edit,,txt,,,,,,,,523,,,,,,
KasaFis,HarOzKod2,Özel Kod 2,Kasa Fişi Özel Kod 2 nin adı,Edit,,txt,,,,,,,,528,,,,,,
KasaFis,HarOzKod3,Özel Kod 3,Kasa Fişi Özel Kod 3 ün adı,Edit,,txt,,,,,,,,533,,,,,,
KasaFis,HarOzKod4,Özel Kod 4,Kasa Fişi Özel Kod 4 ün adı,Edit,,txt,,,,,,,,537,,,,,,
KasaFis,HarOzKod5,Özel Kod 5,Kasa Fişi Özel Kod 5 in adı,Edit,,txt,,,,,,,,541,,,,,,
KasaFis,KaAcKuSetif,Hayir,Kasa işlemlerinde kasanin aktif kuru kontrol edilsin ve uyarılsın mı?,ComboBox,Evet&Hayir,,,,,,,,,598,,,,,,
KasaFis,KaAcKuSetifC,Hayir,Kasa işlemlerinde kasanin aktif kuru ile seçilen carilerin kuru kontrol edilsin ve uyarılsın mı?,ComboBox,Evet&Hayir,,,,,,,,,599,,,,,,
KasaFis,KaCariCheckit,Evet,Kasa işlemlerinde cari girilme zorunluluğu olsun mu?,ComboBox,Evet&Hayir,,,,,,,,,600,,,,,,
KasaFis,KaKurCheckit,Hayir,Kasa işlemlerinde girilen kurlar gösterilip onaylatılsın mı?,ComboBox,Evet&Hayir,,,,,,,,,601,,,,,,
KasaFis,KasaSilPsw,,Kasa fişinin silinmesi için gerekli olan şifre?,Edit,,txt,,,,,,,*,624,,,,,,
KasaFis,NoMuhKodSave,Hayir,Fiş kaydı sırasında muhasebe kodu kontrolü sağlansın mı?,ComboBox,Evet&Hayir,,,,,,,,,873,,,,,,
KasaFis,NoOzKod1,Hayir,Kasa fişinin Özel Kod 1 in girilmesi zorunlu olsun mu ?,ComboBox,Evet&Hayir,,,,,,,,,883,,,,,,
KasaFis,NoOzKod2,Hayir,Kasa fişinin Özel Kod 2 in girilmesi zorunlu olsun mu ?,ComboBox,Evet&Hayir,,,,,,,,,889,,,,,,
KasaFis,NoOzKod3,Hayir,Kasa fişinin Özel Kod 3 ün girilmesi zorunlu olsun mu ?,ComboBox,Evet&Hayir,,,,,,,,,895,,,,,,
KasaFis,NoOzKod4,Hayir,Kasa fişinin Özel Kod 4 ün girilmesi zorunlu olsun mu ?,ComboBox,Evet&Hayir,,,,,,,,,901,,,,,,
KasaFis,NoOzKod5,Hayir,Kasa fişinin Özel Kod 5 in girilmesi zorunlu olsun mu ?,ComboBox,Evet&Hayir,,,,,,,,,907,,,,,,
KasaFis,SatirSatirSor,Hayir,Satır satır yazdırmak ister misiniz sorusu sorulsun mu?,ComboBox,Evet&Hayir,,,,,,,,,1164,,,,,,
KasaFis,SaveMuh,Hayir,Kasa işlemlerinde kaydetme işleminden sonra muhasebeleşme otomatik başlasın mı?,ComboBox,Evet&Hayir,,,,,,,,,1179,,,,,,
KasaFis,SMMKdv,,Serbest meslek makbuzu KDV oranı,Edit,,txt,,,,,,,,1240,,,,,,
KasaFis,SMMSt,,Serbest meslek makbuzu stopaj oranı,Edit,,txt,,,,,,,,1241,,,,,,
Kredi,OzKod1,Özel Kod 1,Kredi Özel Kod 1 in tanımı,Edit,,txt,,,,,,,,957,,,,,,
Kredi,OzKod2,Özel Kod 2,Kredi Özel Kod 2 nin tanımı,Edit,,txt,,,,,,,,991,,,,,,
Kredi,OzKod3,Özel Kod 3,Kredi Özel Kod 3 ün tanımı,Edit,,txt,,,,,,,,1011,,,,,,
Kredi,OzKod4,Özel Kod 4,Kredi Özel Kod 4 ün tanımı,Edit,,txt,,,,,,,,1030,,,,,,
Kredi,OzKod5,Özel Kod 5,Kredi Özel Kod 5 in tanımı,Edit,,txt,,,,,,,,1049,,,,,,
Kredi,RotatifBSMVOran,5,BCH Kredi tipinde hesaplamada kullanılacak BSMV Oranı :,Edit,,num,,,,,,,,1150,,,,,,
Kredi,RotatifYilGun,360,BCH Kredi tipinde hesaplamada kullanılacak Yil Gunu :,Edit,,num,,,,,,,,1151,,,,,,
KrediFis,AutoBelLoc,Evet,Kredi kartı işlemlerinde evrak numarası artımı lokasyon bazında olsun mu?,ComboBox,Evet&Hayir,,,,,,,,,65,,,,,,
KrediFis,AutoFatNo,Evet,Kredi kartı işlemlerinde evrak numarası otomatik artsın mı?,ComboBox,Evet&Hayir,,,,,,,,,71,,,,,,
KrediFis,AutoTip,EnBuyukNo,Kredi kartı işlemlerinde evrak numarası arttırılırken hangi kayıt üzerinden işlem yapılsın?,ComboBox,EnBuyukNo&SonNo,,,,,,,,,81,,,,,,
KrediFis,BAClosedV,Hayir,Kredi Kartı işlemlerinde borç alacak kapatma tuşu görünsün mü?,ComboBox,Evet&Hayir,,,,,,,,,93,,,,,,
KrediFis,BAClosedVAS,Hayir,Kaydetme işleminden sonra borç alacak kapatma ekranı otomatik çıksın mı?,ComboBox,Evet&Hayir,,,,,,,,,99,,,,,,
KrediFis,CariOzKodVisible,Hayir,Cari seçim listesinde özel kodlar görüntülensin mi?,ComboBox,Evet&Hayir,,,,,,,,,180,,,,,,
KrediFis,HarOzKod1,Özel Kod 1,Kredi Kartı Fişi Özel Kod 1 in adı,Edit,,txt,,,,,,,,524,,,,,,
KrediFis,HarOzKod2,Özel Kod 2,Kredi Kartı Fişi Özel Kod 2 nin adı,Edit,,txt,,,,,,,,529,,,,,,
KrediFis,HarOzKod3,Özel Kod 3,Kredi Kartı Fişi Özel Kod 3 ün adı,Edit,,txt,,,,,,,,534,,,,,,
KrediFis,HarOzKod4,Özel Kod 4,Kredi Kartı Fişi Özel Kod 4 ün adı,Edit,,txt,,,,,,,,538,,,,,,
KrediFis,HarOzKod5,Özel Kod 5,Kredi Kartı Fişi Özel Kod 5 in adı,Edit,,txt,,,,,,,,542,,,,,,
KrediFis,KrAcKuSetif,Hayir,Kredi kartı işlemlerinde hesap numarasının aktif kuru kontrol edilsin ve uyarılsın mı?,ComboBox,Evet&Hayir,,,,,,,,,654,,,,,,
KrediFis,KrKurAllow,Hayir,Kredi kartı işlemlerinde hesap numarasının aktif kurundan farklı kurda işlem yapılabilsin mi?,ComboBox,Evet&Hayir,,,,,,,,,660,,,,,,
KrediFis,KrKurCheckit,Hayir,Kredi kartı işlemlerinde girilen kurlar gösterilsin ve onaylatılsın mı?,ComboBox,Evet&Hayir,,,,,,,,,661,,,,,,
